date;submission_text;comments_text
2015-10-01 23:45:37;Welcome to Gnosis v0.0.2! Now with remote Ethereum Node, browser based wallet, BTC Deposit and new markets!;I'd like to suggest a market:  Will the Patriots go undefeated in the regular season (16-0).  Lots of of New Englanders think they will due to the obvious smear campaign by the NFL against Brady and the absurdity and outright slander and libel of deflategate, and the fact that the Patriots play better after they have been unjustly targeted.  (They went undefeated in the regular season after being unjustly targeted in Spygate.)  Statistical website fivethirtyeight calculates the odds of them going undefeated this year in the regular season to be only 4.4%. Keep up the good work! Huge improvement!! can you use gnosis as a browser based wallet without using the gnosis platform :) ?Wow, very nice!Just a small bug I noticed. I often bet on multiple outcomes. So first I buy outcome 1, then start entering data for outcome 2. If in the meantime the transaction from 1 gets confirmed, the page is refreshed, so I have to enter values for outcome 2 again.Is the browser wallet stored in localStorage?  Can we transfer the browser keys from one browser to another?
2015-10-01 21:59:59;uPort: The Wallet is the New Browser;">The second stage of Persona will focus on having a Persona Identifier, which means even if the user loses their private keys or has their private keys compromised, they will be able to restore their persona.  A “multisig” system will enable this

Wow!  Evolution before our eyes, really cool stuff...coooooooooolg00dbye misst! <3So do the users upload their private keys?"
2015-10-01 20:40:41;Jupyter notebook kernel for ethereum?;"Don't know what you want an actual specialized Jupyter **kernel** for? [pyethapp](http://github.com/ethereum/pyethapp) as well as [pyethereum](http://github.com/ethereum/pyethereum) should work just fine in a Jupyter notebook with a python kernel. Furthermore I believe that the pyethapp console is already based on ipython.
Or am I missing sth?"
2015-10-01 17:56:28;Use storage if data need to be referenced by another contract, use events if data does not need to be referenced by another contract;"use storage only when future transaction validation depends on itSeems right to me.

That said, I think one of most important aspects of Ethereum is how easy it is for contracts to build on each other. So I would take a liberal view on what might be useful for other contracts to reference.So events are permanently on the blockchain, just not accessible by contracts? I.e. they'd be safe for ""proof of existence"" applications?Whats the gas tradeoff of storage vs events?

Don't they need to store the same bytes? why would they cost  different?"
2015-10-01 14:52:34;So is there an eth wallet i can download yet??;"You can try this: It is still in testing/alpha!!! For Developer Preview

https://blog.ethereum.org/2015/09/16/ethereum-wallet-developer-preview/How would the average joe get into eth if there's not even a simple official wallet available?Short answer: No"
2015-10-08 21:25:20;Cameron Winklevoss on Ethereum;Confirmed: Mark Zuckerberg to launch an Ethereum exchange
2015-10-08 21:16:53;Ethereum Alarm Clock - 0.3.0 Release;"So is it possible to do a ELI5 on this?The pi-million gas limit is currently my nemesis.  All of the room that I made by extracting the call tracking into an external service got immediately eaten up when I re-enabled all of the events.

Up next (when I find how to fit it into the gas limit) is recurring call scheduling as well as scheduling calls for timestamp rather than block number.Great service, this was already one of the possible use cases for Oraclize.it but of course it is lacking proper documentation (coming in the next few days, stay tuned)."
2015-10-08 19:38:01;Gartner Says the Programmable Economy Has the Potential to Disrupt Every Facet of the Global Economy;"> The programmable economy, enabled by metacoin platforms and smart technologies [...]

This seems an oddly vague reference -- clearly by ""metacoin"" they mean ""blockchain"", but they didn't even mention the latter word, even though a reader is much more likely to pick it out of a press release :)"
2015-10-08 17:15:27;FarmShare -- decentralized community-supported agriculture platform -- Callicoon, NY Art Walk this Saturday;"Great demonstration of blockchain technology past transfer of value and financial apps evolving into other verticals that would seemingly be unassociated. kudos to this team. Check out the white paper here: https://docs.google.com/document/d/1jntZtiw0VQQ6ZctVyWsCcg-ZGvv6MCSvlFIIPG5GDSg/edit?usp=sharingI want so badly for this to be a success, but I feel that the traditional CSA tools have suited that community fine, especially considering that the folks who use CSAs might value direct simplicity above technology.

~~Is there evidence that CSA's are clamouring to solve some problem that their stakeholders are feeling in previous manual system?~~

~~But regardless, thank you thank you thank you for reaching out in so many directions with your work ConsenSys!~~

EDIT: reading whitepaper. (was basing comments on friends' use of CSAs, but I should read first)I keep an eye on your project. See if this model can integrate with farmshare: https://www.linkedin.com/pulse/circularchain-secure-convertible-credit-system-local-ferreira
"
2015-10-08 16:55:11;Finadium Research Report: Can the Blockchain Work for Securities Finance, OTC Derivatives and Other Collateralized Transactions?;Much appreciated if anyone has access to the full report and can share some insightsWe are making the Dai stablecoin in order to, among other things, facilitate decentralized derivatives that require nothing more than an oracle you trust. It can be decentralized, like Augur, or it can be centralized. We're making a tool called keeperd that allows anyone to run centralized oracles that report to the blockchain, and there are already other similar tools available that have been posted to this subreddit.
2015-10-15 21:24:48;Bitcoin-NG: A Secure, Faster, Better Blockchain;"My understanding after a first read: when a miner solves a block, it is given the right to issue 'microblocks'. Microblocks are signed by the miner and don't need any hashcash, so they can be emitted near-instantly.

Its a pretty interesting idea.I think Vitalik's already talked about what NG is.

Something like GHOST/SLASHER, except there are no bonds, the validators are not made ahead of time, and the validators get sole mining rights for about ten minutes at a time.

There's probably more to it than that though, it's pretty cute, and a valid move forward.Some criticism here: https://botbot.me/freenode/bitcoin-wizards/2015-10-14/?msg=51893857&page=3

And here: http://lists.linuxfoundation.org/pipermail/bitcoin-dev/2015-October/011528.html"
2015-10-15 19:04:49;The new GUI wallet is mentioned in today's cryptocast 'Ethereum to Earth, Cannabis ❤s LEDs, & Everything Drones';
2015-10-15 19:02:42;Homestead?;t_ _ w _ _ _ sThat's way outdated. We're basically already in Homestead. The network won't be shut down, there won't be a 10x mining increase, etc.Pressure has put a fire under the devs and they've rightfully released the GUI early, removed checkpoints, and allowed full miner rewards.  They'll probably redefine the stages soon.
2015-10-15 15:13:57;Sidechains on Ethereum?;"Well, there is btcrelay contract https://github.com/ethereum/btcrelay/
Depends a bit on your definition of 'sidechain', I suppose.  This gets 'something' done on the Ethereum chain if a transaction on the Bitcoin chain has 6 confirmations.  Why technical leadership? Sidechains exist already in Crypti for example. They are nothing new and soon will be implemented into Bitcoin as well. "
2015-10-15 14:55:04;Ethereum Wallet Beta2 released, with fixed ghost wallet bug!;"The wallet on OSX is excellent. I hope we can soon see an official wallet that doesn't come packaged with a full node.The ghost wallet bug showed you transactions of other users, after you created a wallet..

This release also contains bundled nodes for linux 64 bit.hi can you guys make a backup wallet option in the next version. Sort of like what btc has in bitcoin core client.So the wallet is separate from the node?
Which is still command-line only?Looking forward to beta3 within the next 24 hours :)can i just do apt-get update upgrade? or do i download and install again?Downloaded ""Ethereum-Wallet-win64-0-3-2.zip ""- double click and it runs fine! Thanks! 
Can I just delete the old on? Are there no relevant information stored?Can't run the wallet on windows 7. It says: 'Are you already running a node? Make sure your IPC path is set to the default:'Can we pass command line arguments to geth when it starts it up? E.g. specifying a test network id. (I couldn't find how to do that through the console.)Is the pre-built Ethereum-Wallet-win64-0-3-2.zip correct?

Inside of the zip is a folder named __MACOSX and another folder named Ethereum-Wallet-win32-x64-0-3-2.

/u/frozeman can you verify for me? Thanks."
2015-10-22 23:24:15;Lightning-style Off-chain trading;Ive been solidifying [sic] on an implementation called Zap.sol would be great to see a community formulation on off chain txs. Perhaps as a layer on top of the standardised token apis 
2015-10-22 20:28:37;Ethereum Accounting - Basic accounting solidity library;"Great work! You keep releasing things that I want to try and use, but don't have the time :P

I will get to it though!Great work!  Could you put together a wiki page with all your libraries?  

/u/Digixbot ethtip 10 eth/u/digixbot ethtip 100 finney  Nice job this is how Ethereum grows /u/kcchng"
2015-10-22 20:25:39;Nick Szabo Confirmed as Keynote Speaker of Ethereum’s DEVCON1;"Great! He was included on my wishlist! 
:-) https://www.reddit.com/r/ethereum/comments/3mu7r5/which_presentations_you_would_like_to_attend_at/ So what day is he speaking? I dont see it on the frontier agenda. Considering travelling but need to book flights etc and can't afford ticket for full week.International Business Times announcement:

http://www.ibtimes.co.uk/nick-szabo-be-keynote-speaker-ethereums-devcon1-london-1525275 Wow, that's great news!How good was this news... good enough to have caused 40%+ increase in ETH value! Awesome!This is an awesome news! Looking forward to the talk when it becomes available.https://www.youtube.com/watch?v=7Y3fWXA6d5kMaybe he can help the foundation out with his million Bitcoins!"
2015-10-22 20:08:54;It doesn't add up...?;"This is weird. It states ""Balance: 2.2853505763883548 Ether"" (same on http://frontier.ether.camp/account/ada4d61741571dd3a5dff874deadbeef65308d3a) -- the 9 received transactions don't add up though:

1 Ether +
58.07256366573801 Finney +
64.641737406375576 Finney +
71.940819340417304 Finney +
8 Wei +
8 Wei +
8 Wei +
90.69545597582386 Finney + 
9 Wei != 2.2853505763883548 Ether

I wouldn't say it was weird, if not ether.camp and etherchain.org came up with the same incorrect number.

Any ideas what's going on here?"
2015-10-22 18:39:59;Etherdice - provably fair and escrowed gambling now in public beta (with limited funds);"As always, please follow the recommendation to always verify the contract of a Dapp before you use it. As soon as you do that, you will notice that the compiler will issue a warning for this contract. This warning exists for a reason. I am not sure how far this can be exploited, but at least it is possible to change a value which is not supposed to be changed in this way.

It would be great if at some point we could have a contract that supplies entropy and charges at a fixed rate per random bit instead of exploiting people's weaknesses or even illnesses... I guess you can also write a contract to bet on your behalf and try arbitrary betting strategies and try to game the system (which will of course statistically always fail).Apologies to player 0xd927... the website was briefly incorrectly displaying the contract's state - please refresh to see the correct results (payouts took place correctly). Thanks for giving it a try!I won :) Cool site!Is the site down?"
2015-10-29 21:26:26;Antok: Assembly Self-Governance and Resource Management Platform - DEMO SITE LAYOUT;"Still have management and other sections to do and entire proposal will need a re-write once I finish layout. Right now tossing up best way to implement a gift economy and a suitable work credit system which can be used for all related features. Setup constitutions and agreement system for any type of proposals and counter proposals to achieve mass consensus and resolutions on issues, which will be a pre-requisite to main voting, except regarding basic re-occurring issues. Hey, it's a quite interesting project. I've been myself also interested in the topic, and my approach is more at the local community level than at the occupy wall street level. But the concepts are very similar. One thing you could consider is how to associate voting with raising money. Basically weighting votes by the amount donated to the organization. This way you can create a community that give as much weight to the ""voluntaries"" people that work and receive the crypto as ""salary"" or by answering to some bounty requests, and the donators to the organization. Those are the two components of the organization and they should in practice be able to vote proportionally to their involvement. The more you care, the more you donate your time/money, the more you have influence in the decision process. Ethereum offer the possibility to do this in a pseudo-anonymity, and to encode organization-building operand conditioning crypto-currency incentivization into the DNA of your organization. It's pretty exciting."
2015-10-29 16:48:00;ConsenSys Weekly - Oct. 29, 2015;
2015-10-29 13:49:11;Cover of The Economist;other article in this issue is here http://www.economist.com/news/briefing/21677228-technology-behind-bitcoin-lets-people-who-do-not-know-or-trust-each-other-build-dependableIt's a fantastic boost for the ecosystem as a whole.Why no Ethereum mention :(
2015-10-29 13:43:24;Economist: The great chain of being sure about things;"[deleted]What an excellent title :)

"
2015-10-29 13:10:51;One of the 'leaders' from the Oct. 31st print edition of the Economist will mention Ethereum.;Yep.  Here it is.  [Moon.](http://imgur.com/oy2f1J3)Looks like it will indeed! https://twitter.com/TheEconomist/status/659718867070119940
2015-11-05 21:47:46;How can Ethereum be used as a computational engine for IoT?;"A publicly accessible computing protocol married to a database with impenetrable security. This basically describes both Ethereum and a perfect scenario for IoT. Any device with the built capability can spend ETH from it's wallet to communicate via the blockchain. 

Furthermore, not only can the device communicate on its own network as it would if it were powered by, say, IBM servers, it can communicate with any device from any company on Ethereum. For example this means that instead of automatically ordering an overpriced replacement bulb only from IBM at the end of it's life, it could search for the least expensive equivalent replacement that has a good reputation. As far as I understand, the idea is to implement (in Ethereum 2.0 or 3.0, but certainly after switch to Proof of Stake) Ethereum consisting of many sub-chains, or fibers, each validated by its own set of validators, merged together by some other validators, and sending messages to each other in some ways. Each fiber will have its own database if you like. This might take few years to come about though"
2015-11-05 21:06:08;Ethereum Buying & Selling platform?;"I've been working on a marketplace for Ethereum. I know of at least one other person doing sonething similar.

github.com/safemarketSomeone could fork openbazar and then change it to ether from bitcoin...maybe. It would take a lot of tweaking on the blockchain end.Check out EtherEx (https://etherex.org/)."
2015-11-05 20:55:04;Did I just solo-find a block? How do I confirm this?;"I thought that maybe I cropped bellow the important information.. 
and while I was thinking about this I think I found a new one...

Can someone enlight me please? I'm a bit lost! just started mining...
http://imgur.com/GUBIR9FNo. You would have received 5 ETH in your account if you mined a block or a smaller amount if you mined an Uncle. When I was doing some early mining the console output would also show a small gold hammer icon on a line when a block was successfully mined.You are mining on ethpool.org

The way pools work is that they give you work that is easier than solo-mining, meaning that you will find a valid share every few seconds or minutes. Occasionally, someone will find a share that is good enough to submit to the network, but the ether will be given to the pool, since shares are only valid if the coinbase is set to the pools address.

If you check your balance on etherpool, it should be increasing (but it might take a bit to update)"
2015-11-05 18:14:56;Slock.it to Introduce Smart Locks Linked to Smart Ethereum Contracts, Decentralize the Sharing Economy;"“[Smart contracts] embed contracts in all sorts of property that is valuable and controlled by digital means,” wrote Szabo in 1997. “Smart contracts reference that property in a dynamic, often proactively enforced form, and provide much better observation and verification where proactive measures must fall short. [These protocols] would give control of the cryptographic keys for operating the property to the person who rightfully owns that property, based on the terms of the contract.”

Slock.it is fulfilling Szabo's prophesies :-)Sorry for being that guy, but can anyone give me a simple use case? "
2015-11-05 16:43:32;Can some expain Gavins comment at 40.50 mins please?;"The nature of the ""next funding round"" is, at this stage, uncertain. Vitalik has suggested a few possible routes [https://blog.ethereum.org/2015/09/28/the-evolution-of-ethereum/]. There is, in my opinion, a substantial possibility of it being done in concert with resources and funds from industry.

I'm generally in favour of neutrality over the specific terms of account for a stakeholder solution (""currency-agnostic""), since it removes certain human-centric issues: maximalism is generally not a good thing IMO, be it Bitcoin or Ether and freeing a technology platform from an underlying ""currency"" would, I think, result in far greater overall adoption.

That said, I'm yet to convince Vitalik on its merits, it looks rather difficult to implement and I don't, in any case, consider it a particularly important ""feature"". Once I think of ether as a ""decentralised service token"", and expunge ""currency"" from my mind, then I already feel better.

For what it's worth, since the launch of Frontier I have only bought Ether. To the moon :-PFor the lazy: ""After our next funding round, we're aiming for a 2.0 release in a couple of years' time.""

A bit later: ""It'll be currency-agnostic.""

Does make you wonder what the impact could be for people holding ether.Might it be reasonable to formally ask the Dev team at some point over the next few weeks to clarify their position on Ether? Serious investors who may wish to acquire stocks of it to run software on Ethereum may currently be put off by precisely this uncertainty. In short, could the Dev team at some point confirm that they will not drop, sideline, or marginalise Ether?The potential for tokens other than ether to be used as payment for contract execution has been mooted before by Vitalik: https://blog.ethereum.org/2015/07/05/on-abstraction/It _could_ mean a bulk sale of part of ther Foundation's Ether stash to (a number of) investors, like they recently did with the Chinese fund.

As far as I am aware, the Foundation has not sold any Ether on the open market.There was a question from the audience that I think should have explained that contracts also have addresses so the msg.sender/tx.origin would also apply to contracts calling other contracts.  I actually quite liked his talk. He might also call it ""back to Smalltalk"" :) Though, of course, Ethereum is different from Smalltalk in many ways...The funding round or the improvements? I think Vatilk mentioned they would be out of money soon since the BTC sale didn't factor in the major price decrease. "
2015-11-12 22:14:00;Which DApps presented thus far at Devcon1 do you find to have the most groundbreaking potential?;"I'm really interested in the Reddit oneI'm excited to see Maker release the Dai and the credit system that underlies it. Loans are a huge market.

Edit: thought I'd leave this here https://www.makerdao.com"
2015-11-12 19:12:42;Anyone working on decentralized DNS/SSL?;"Namecoin??

https://namecoin.info/Yes, at [Rebooting The Web Of Trust](http://www.weboftrust.info/) we began work on what we're calling **DPKI**, or **Decentralized Public Key Infrastructure** as an alternative to PKIX X.509 and DNS. The goal is to first release a whitepaper (being finished up as we speak), and then creating a spec for it via IETF.

Contributors to the paper so far are (sorted by last name):

> Christopher Allen, Arthur Brock, Vitalik Buterin, Jon Callas, Duke Dorje, Christian Lundkvist,  Pavel Kravchenko, Jude Nelson, Drummond Reed, Markus Sabadello, Greg Slepak, Noah Thorp, Harlan T Wood

Here's a section from a draft of the paper:


> **The DPKI Specifies A Datastore Agnostic Protocol**
> 
> If a DPKI were to specify a specific blockchain as its “defacto decentralized
> datastore”, that in itself would put centralization pressures on that
> blockchain.
> 
> For example, if Ethereum were named the defacto datastore for a DPKI, it would
> be problematic for end-users should the blockchain become centralized.
> Software developers, having coded support for a specific blockchain, would
> have to expend more effort to rewrite that software to support a different
> blockchain. It would also break the entire system if a blockchain disappeared
> due to a lack of miners or interest in the chain.
> 
> **Therefore, the use of an agnostic protocol for accessing decentralized
> datastores is a requirement to ensure the functioning and the decentralization
> of the DPKI as a whole.**
> 
> Agnostic protocols make it easier for users and developers to migrate to a
> different datastore that better serves their needs, and the mere existence of
> this possibility increases the quality-of-service (QoS) that every
> participating datastore provides through the creation of a market of
> decentralized datastores. Like this? http://www.reddit.com/r/ethereum/comments/3sjdkm/a_fair_namespace_without_tokens_or_crowdsale/"
