date;submission_text;comments_text
2014-02-13 20:32:16;Important Statement regarding the Ether pre-sale and the recent peercover announcement;
2014-02-13 15:27:18;Where does a contract actually execute?;"The contract runs on every computer in the network, and every computer must agree exactly on what the result of the computation is, or there will be a fork.
"
2014-02-13 14:58:50;An open letter to Vitalik and the Ethereum Team: Don't let your fire consume you;"That was a beautiful post, thank you.

I'm well aware that this whole project might fail. Governments might all choose to take a strong stance against cryptocurrency and DAOs, people would lose interest, Bitcoin would drop to $10 and we would then have no real reason to keep going forward. BTC is an incredible risky space that can go to the moon, into a puddle or anywhere in between, and we're inextricably tied to that at the very least.

I have been in very deep despair before; aside from the episode of unrequited love in high school that basically deprived me of any opportunity for consistent happiness for most of a year, perhaps the worst was in late 2012 when the team behind Bitcoin Magazine, which I had sacrificed every opportunity to go out with friends or socialize in university to write for for about a year, was on the verge of falling apart due to internal strife. People who I thought were responsible adults who knew they were doing, and who I thought I could trust and count on, turned out to be my enemies. Luckily, we survived, but at the cost of selling 60% of the company for close to nothing and by the skin of our teeth. And then in March 2013, at what seemed to be the height of our glory, I remember staying up past 1:00 in the morning for the first time in two years when the Bitcoin blockchain forked, I was watching the price rapidly tank from $47 to $38, and I literally felt as if some close family member was in an emergency room and was dying in front of my eyes. So you're talking to a battle-scarred serial entrepreneur here (which I think we all have the right to call ourselves after what we've been through), not a delicate child. We'll be fine.Nice post - having been part of 3 web startups I know all too well what you're describing.

For what it's worth, Vitalik is by far the most level-headed person I've ever met throughout my career, regardless of age. The project is in good hands. 
I say the fire that burns IS an unlimited resource IF the goal of the work you are doing is for the good of all- if its selfless- 

IF the work you are doing is selfish- then yes it is limited and you will burn out and/or turn to drugs etc-

I believe that the end goal of the Ethereum project is to make the world a better place because of what its going to make possible- a selfless goal- a noble goal-

Whenever true genius shows up- people seem to try to get the person to be ""reasonable"" and work ""within their limits"" How can anyone know what the limits are? They can't!

You can't do the ""impossible"" if you adhere to other peoples limits-

I know that Nikola Tesla's friends urged him to not work so hard but he could see things no one else could- he hit targets no on else could see and worked towards his goal tirelessly- and the whole of humanity is glad he did.> I encourage you to temper your inner fire. Do not burn it too brightly, do not succumb to mania. The fuel which it burns is not a limitless resource.

I'm reminded of this scene:

http://www.youtube.com/watch?v=O5MDGMvrSJc&t=02m21s""Avoid recreational drugs""
Ever heard of Atari?"
2014-02-13 10:23:40;First Ether Forwards Exchange Opens;"This is a bit problematic. Theoretically, we may well decide to redenominate back to 10000 ether per BTC, or 1 ether/BTC, or even some model where we release 10000000 ether and split it proportionately among buyers. So being long or especially short ether at this point in time (and someone has to be short, since a total of 0 ether have been sold/released) is insane IMO. Once we finalize the terms, however, then things like this might be viable.

Also clarifying that this platform is not affiliated with us.I've had that question dozen of times today - Ethereum is not in touch with Peercover. We are trying to make contact. Peercover can you please explain a bit more about this project?what is your guarantee that you don't run away with my money?There are complicated issues that we (Ethereum.org) need to resolve before we can make any clear statements about the initial ether sale.  Any action taken by any individuals or groups before we release official documents is premature and may lead to a significant loss.  

While we are aware of and have respect for the work peercover.com is doing, they are in no way officially associated with Ethereum Project, do no speak for it, and are, in our opinion, doing a disservice to the Ethereum Project and possibly leading their own clients into a situation that they don't understand.  Offering to sell ether that doesn't yet exist, to naive purchasers, can only be considered irresponsible at this point.  Buyer beware.

We request that peercover.com cease to offer ether forwards, until there is more information released on The Ethereum Project, the potential value of the ether cyptofuel, and until lawyers in various countries clarify what the securities and regulatory issues might be in selling ether to the public in various countries.

And of course, peercover.com, please feel free to reach out and discuss with us how we may work together in the future.  Thank you.
scam scam scam scamYes please. This looks such future. http://blog.ethereum.org/2014/02/13/important-statement-regarding-the-ether-pre-sale/Got all excited for nothing. I thought I could finally buy Ether...
When do they open the floodgates and let us invest?"
2014-02-13 05:22:01;Which DAC/DAO projects could we try to convince to use ethereum? Here is a link to a list of some.;
2014-02-20 20:51:13;Some possibilities for financial DAOs;"Setting aside the free-wheeling, assertion-laden OP text in general, the concept of a DAO-based credit union or mutual S&L is intriguing.  A cooperative financial middleman potentially could reduce the net fee structure of the commercial banking system at least for participants.  Within a cooperative/mutual structure stake, identity, reputation could be built.  This is analogous to the local S&L where borrowers and depositors generally came from the same community and knew each other even when the books were private to the banker.
As to some of the other grandiose, dramatic and colorful claims in the OP, I suggest some qualudes and a bit more attention to the basic blocking and tackling of financial intermediation.  There are, in fact, many reasons borrowers go to lending institutions and investors to deposit takers rather than publicly marketing their project or evaluating the global universe of investment options.What we need is a a tree of the different types of services and organizations that could be turned in to DAO's or DA somethings+/u/fedoratips 100 tips"
2014-02-20 16:55:56;How do I join ?;"Where do you live? I would consider checking out an ethereum meetup group: http://ethereum.meetup.com/

And if you haven't already, give the whitepaper a read: https://github.com/ethereum/wiki/wiki/%5BEnglish%5D-White-Paper"
2014-02-20 11:35:23;The pre sale have started yet?;"No. We haven't announced anything yet, but we hope for an announcement towards the end of this month, followed with a start during March. 

Please help me relay this information -  there will be no reason to 'rush', it won't be a race and we will give people plenty of time to inform themselves, exercise due diligence and participate. 
Patience. Patience. In the meantime, check out counterparty, as it seems to tackle similar challenges. "
2014-02-20 10:43:27;I know absolutely nothing about coding...;"I assume you don't know HTML either, yet this doesn't make the internet useless for you. Same goes for ethereumI'd also like it if Ethereum can deliver a nice GUI for non-developers to create their own DAC's, contracts, currency, bitshares, colored coins and so on. I think that's ultimately the goal, and I think innovation and adoption would *explode* if they did that. 

We need to get the point where a mom-and-pop online store can make a DAC even more easily than they can make their own LLC in the real world. I think that's the dream, and that's when you will see huge adoption of Ethereum as a platform for all sorts of stuff we can't even imagine now."
2014-02-20 03:28:48;A possible way to reduce blockchain size;"A block in Ethereum already stores the complete state alongside the tx list, so new clients can ""start in the middle"" and work without having to verify the whole chain, and then discard the history after a few thousand blocks to save space.Interesting but might have been better suited to /r/bitcoin as Ethereum is not UTXO based.Why not just have the client store only unspent transaction outputs? If I remember correctly the UTXO set is still less than 1GB.

Simpler, and accomplishes the same thing, unless I'm not understanding something."
2014-02-27 16:39:43;"Roger Ver is bullish on Ethereum: ""Bitcoin and Ethereum provide us with the tools we need to build this more peaceful and prosperous future""";Thanks again coinwatcher, you are hands-down superior! Excellent job on IAMA consolidation TOC. (Sticky that!) Are you actually several people that pass as your redditor or a single human devoid of sleep and a regular job? Many coin watchers want to know???Not sure if that's a good thing, he was bullish on MtGox a month ago.
2014-02-27 11:36:24;Having trouble downloading ethereum through go.;"Most likely the installer set your GOROOT but not your GOPATH, you will have to do that yourself. I would advise you to create a folder in your documents called go-projects or similar and then set your the GOPATH to this value.

To set this path do the following, i'm paraphrasing since my Windows installation sadly isn't English:

* Open the control panel
* Use the search option to search for ""Setting the environment variables for this system""
* Look for the button that says ""Environment variables""
* Press the button ""new""
* Name should be GOPATH and the value should be the folder you just created (copy the path via the explorer)

Please try it again after that, also note that in due time there will be binaries available; so if you are really curious this could all work but I'm not sure if it will be worth it if you are not a developer yourself. Does any of these StackOverflow links help?

http://stackoverflow.com/questions/20628918/cannot-download-gopath-not-set
http://stackoverflow.com/questions/19854835/gopath-environment-variable-not-set"
2014-02-27 00:34:39;Senator Joe Manchin Wants to Ban Bitcoin--Change.org Petition is Live;
2014-02-27 00:17:10;Mt. Gox: Failure and Opportunity - Comments appreciated;That's called [merged mining](https://www.google.com/url?q=https://en.bitcoin.it/wiki/Merged_mining_specification&sa=U&ei=2I0OU93iB4K-2wXy1YCIAw&ved=0CBIQFjAD&usg=AFQjCNHA8n8JYLeHsNUsrG0lxXfCEZHxtw). The idea has been around for a few years now. Some of the multi-blockchain scalability ideas we are looking at actually rely on the idea.Good write up. One thing of note is that there are cold storage companies out there. I read about one recently, in England I believe, that stores customer coins in cold storage, insured by Lloyd's
2014-02-26 12:08:24;Could code obfuscation remove the need for centralization?;"A scripts behavior is also basically proven to be calculated correctly by agreement on the results in the blockchain, so a script making a block is basically circular; a theorem being proven with an argument being itself.

Basically i expect it is essentially a build-in i think that if you have 25%, and you try to fork a block, you can just run that script as if the longer blockchain doesnt exist and nothing is wrong. The script can be made not to object, unlike full nodes not in control of the attacker.. Basically in effect the block would be an extension of the block before it.

Btw/ftr contracts, DAOs etcetera are just script analogues of pre-bitcoin relationships in the world. Scripts are really both more and less than that.Afaics every script that is somehow a 'permanent fixture', with no connections to particular people, and that somehow never loses too much funds to get deleted is essentially equivalent to being a feature of ethereum. 

I cant answer your question, but the above implies ubfuscating privkeys into ethereum itself, not scripts would do the same.

Also, that is a *strong* statement. I.e. if you could for instance have 'magic infinite funds' for something like the [dropbox example](http://www.reddit.com/r/Bitcoin/comments/1ylvcp/the_ethereum_scam/cflsmuz), basically having that file could be used for mining! 

Note afaict the dropbox scheme does not actually pay for serving the data to people.. Got [a concept](http://www.reddit.com/r/ethereum/comments/1yvr3a/bitcoins_price_fall_will_affect_ethereums_launch/cfoa3j4) for that too, but with inflation subsidy servers would create fake viewers. Basically it cant be taken for granted that mechanisms cant be played.

Still, many scripts could be subsidizable with inflation, and not be fraudable.(i dont quite know)

Anyway, a little inflation may be a good thing, but it does beg the question who should get the coin. Regular mining is wasteful, so these are interesting, and that it can be done with script is aswel. Perhaps sub-currencies of ethereum could do it internally.

That said, i dont quite know how to give such a sub-currency value, ethereum itself could presumably only do it, but we currently only have relatively limited practical knowledge of scripts. Voting on scripts that would subsequently get some limited-to-the-desired-inflation 'magical funds' is an idea, but voting might presumably done by weight of coins, so there is a danger to overcentralization of coin through it..

Some of this is kindah like a government, but the taxation is inflation."
2014-03-06 21:15:26;Conditional futures for DAOs to outsource decision-making;"Essentially you're describing [futarchy](http://hanson.gmu.edu/futarchy.html), invented by economist Robin Hanson. People bet on what would happen if various actions were taken, the decision-maker takes whatever action has the best odds of success, and bets on actions not taken are nullified. His paper has details on setting up the bets, I suspect it could easily be implemented in Ethereum.

Hanson describes it as a way to run the government, with people voting on what to optimize. That seems a bit impractical to me. Lots of little futarchies like you describe might work out better. Various actors could choose to optimize whatever they want, and let the market help them decide what's most likely to work.See [this discussion](http://forum.ethereum.org/discussion/comment/2720#Comment_2720) on the Ethereum forum about Malicious Contracts and DACOs (Decentralized Autonomous Criminal Organizations)I'd really appreciate any feedback y'all have on whether conditional futures are:

1.  A real thing, and 

1.  A potentially effective way for a DAO to make rational decisions. "
2014-03-06 05:49:13;Funding & investing in ethereum;Will BTC investments in ethereum offer annual interest returns? New to BTC investing, I'm interested in funding a decenteralized network though. How secure is a funding in ethereum, i know that bitcoins tend to fluctuate in value-right?read the forums on the ethereum site. They will make an announcement there when they are ready to do the funding round
2014-03-05 22:56:33;I am doing some research and would like to hear your opinion on next-generation cryptos;"[deleted]Afaik ethereum can do basically everything the others can do. The others largely have features that arent really up my alley.(but i think i should learn more about the financial ideas behind them)

The main weakness of ethereum is essentially the full-scripting thing, which people often think is prone to bugs. Though it it definitely something to really try hard to keep secure,(which bit of cryptocurrencies arent..) I am not too worried about it. Javascript has had and probably has a lot of security bugs, but interfaces with a lot, ethereum script basically interfaces with stuff that ethereum developpers *also* made, and with a lot less, i reckon.

The second worry/weakness is that the computation and storage of contracts is just too much data to hold on to. Which would hurt volume it can handle, and/or drive the cost of fees up. This one is basically the main worry i have, despite the good lightweight-client thing. That said, if i can be sure there are enough full-nodes out there and the lightweight-client thing works, might already suffice.

Afaik the mechanisms the blockchain works with, the mining etcetera is not exactly set in stone. Fairly confident they're going the right direction. (but not through knowing the direction myself)

The possibilities of the ethereums scripts are enormous, and they are just being explored. Escrow without third party, crowdfunding, subcurrencies, namecoin, dropbox, 'serving and viewing'(not sure of that, dont get responses about it :) ), self-enforcing contracts, (like)self-enforcing rules for organizations, approaches to identify persons to try figure out how to do UBI.

Btw i use the word scripts.. Heard the word (self-enforcing-/smart-)contracts used too, but the problem is that the word contract doesnt always quite fit the bill, script is fairly accurate, but it carries connotations. It is just basically a little program, and most of them would probably be basically from some standard set, with some parameters filled in.Hm... dont know really but i will for sure follow your blog for a while now.It's worth mentioning twister, it's possibly the most interesting Blockchain around!"
2014-03-05 22:27:12;Hey guys!;We haven't announced anything yet. Expect an announcement in March. Mainnet release is Q4 of this year. Thank you
2014-03-05 22:01:00;Clearinghouse with ethereum;Please elaborate on what you have in mind.This might help: https://github.com/ethereum/wiki/wiki/%5BEnglish%5D-Clearinghouse
2014-03-13 21:19:36;Marriage and Divorce - I want half!;"Nice!

Here's the next step. Ethereum contracts can hold more than just ether, and some assets that an ethereum contract might own (eg. smart property) are not necessary divisible. The general incentive-compatible solution to that problem is a standard cake-cutting protocol: [one cuts, and the other chooses](http://en.wikipedia.org/wiki/Divide_and_choose). Problem: implement cut-and-choose as one of the divorce protocols.See also the video walkthrough of this contract: https://pay.reddit.com/r/ethereum/comments/20mb7b/video_walkthrough_of_marriage_smart_contract/"
2014-03-13 13:42:57;How can we estimate the cost of computation and contract execution on Ethereum?;"By simulating a run of a contract you can calculate what the cost [1] of running it would be for various code paths. This cost is in `basefee` units, which is currently hardcoded [2] to be 100 szabo.

[1] https://github.com/ethereum/wiki/wiki/%5BEnglish%5D-White-Paper#fees
[2] https://github.com/ethereum/cpp-ethereum/blob/master/libethereum/State.cpp#L72
These costs need to be kept low as the success of the whole enterprise depends on the proliferation of new ideas in the form of contracts. The people with the best ideas will not always be the ones with most ether. The danger is that the only contracts that are viable are those that generate a huge income, rather than those that fulfil a useful function.

Some nice contracts to see early on would be like basic 'operating system' utilities that provide building blocks,  'pipes' etc. that can be joined up to perform more complex tasks. If the fees are too high, there will be a barrier to creating 'public service' type infrastructure, and people will focus on developing fancy financial instruments and 'get rich quick' schemes that will hinder widespread adoption IMHO.Given the floating nature of the .basefee determined by democratic mechanisms, contract costs can vary from negligible to prohibitive. Ideally, if the economics _and_ democratic process works out, this would be something in between the value people ascribe to getting their contracts executed and costs of running the network. The latter being determined by PoW/computation costs while hugely depending on the scale of the network.
I think it is the right time, that ethereum devs disclose a rundown of their economic model including different scenarios to kickstart people's own conclusions and understand the long-term viability. As mentioned before, scalability or conversely decoupling from increasing marginal costs are the most important factors costwise.I think you may have the old whitepaper. Newest, https://github.com/ethereum/wiki/wiki/%5BEnglish%5D-White-Paper"
2014-03-13 04:02:10;Ethereum: Your turn;Nice! As excited as I am about ethereum, I can't help but think that this is over-hyping it. Are snazzy videos mimicing Apple commercials really what the project needs at this point in its evolution, or would a focus on improving documentation and getting developers involved be more useful?GrandioseAs a developer, I want to dev for this project but am concerned that the company founders will disproportionately benefit financially from code contributions while the developers merely get karma.Good production quality, reminiscent of the opening credits to Enterprise! Not so sure about the Hal Finney ALS reference.Cute.Apologies for the re-up , we had to correct a typo - thank you @david4096 on twitter for pointing that out :)Seems a bit early for this.  ethereum should be able to stand on its own.
2014-03-12 18:06:18;Ethereum, Colored Coins and the Evolution of a Decentralized Economy;
2014-03-12 13:01:33;Ethereum.tips is an unofficial MediaWiki knowledge base for Ethereum;We moved our wiki to GitHub because MediaWiki was antiquated... irony?
2014-03-20 22:46:17;The Latest EVM: “Ethereum Is A Trust-Free Closure System” by Vitalik Buterin (ethereum blog);
2014-03-20 20:36:07;Money & Tech with Vitalik Buterin at the March 6 Texas Bitcoin Conference;
2014-03-20 16:31:42;Write your own smart contracts + Q&A with Jeffrey Wilcke;
2014-03-20 16:29:07;Introduction to Smart Contracts;
2014-03-20 00:07:55;Ethereum meetup at the Bitcoin Embassy. Pic 2;
2014-03-27 22:37:13;VIDEO (4 of 6): Can You Trust The Ethereum Team? - By Tai Zen;
2014-03-27 21:40:27;VIDEO (2 of 6): How & Why You Should Invest In Ethereum (ETH)? - By Tai Zen, Leon Fu, & James D'Angelo;How indeed??
2014-03-27 19:57:38;VIDEO (1 of 6): What Is Ethereum (ETH)? - By Tai Zen, Leon Fu & James D'Angelo;Dont think entering, at once, all of the videos as separate entries in forums and reddit is the best approach.
2014-03-27 19:31:31;Is Ethereum or Open Transactions better for smart contracts?;"Ethereum = more trust-free and more decentralized and fewer semi-centralized points of failure   
OT = more useful for heavy computations, micro transactions, privacy and high-speed and high-efficiency applications like HFT   

That's how I see the distinction.Ethereum is shaping up to be another scam coin.  Look at all the pre-mine!"
2014-03-27 17:46:28;Ethereum Meetup - Denver, CO;"Boulder has a group as well, however that one a.) is in Boulder, and b.) covers crypto-mining in general. 

This Meetup is based in Denver, and focuses specifically on Ethereum - as well as related ""Bitcoin 2.0"" protocols and tools.

Our first meeting will be announced shortly. Any questions or ideas? Lemme know![deleted]"
2014-04-03 14:44:31;Intro to Derivatives & how they can be created on top of Ethereum;This is a great introduction, thank you. If it's of interest, here are my notes on the talk: http://cl.ly/image/263J3S3H0B3R
2014-04-03 13:45:27;Ethereum Building Blocks - Part 1: RLP;advantage seems that to be the compression and fast deserializing of streams. Question to the core team: why have you picked it in the first place? Have you seriously evaluated alternatives, or was it a 'good enough' decision?
