date;submission_text;comments_text
2014-12-04 15:27:57;Can we expect to see some version of youtube or facebook on Ethereum early next year?;"Facebook (Etherbook?) definitely. At first, it may be little more than a namereg combined with chat over whisper (Eth's encrypted messaging protocol). Because without swarm, DApp devs would be left on their own to implement distributed file/content storage (for avatars, thumbnails, images, post archives, etc).

A Youtube (Ethertube?) will depend on the progress made on swarm (Eth's bittorrent-like file-sharing protocol) before launch.There are already P2P alternatives for social networking but nobody uses them because they depend on a certain amount of publicity and understanding of technology to become popular.No."
2014-12-04 13:11:37;Ether price kept artificially high affecting cost of all trade on network;"Ether price is not the same as gas cost. As long as there are miners willing to accept reasonable transaction fees (and why wouldn't they?), the cost of Ether itself is irrelevant.Each miner has to decide which of the available transactions to include, and they personally get the fees from the transactions they include in the block, and with the current specification the number of transactions in a block is limited only by a cap on the gas spent per block, so the highest gas price transactions will be included first, until the block is full or all known transactions are included. So the price will be set entirely by demand, and the equilibrium is gas_demand_at(gasprice)/block = gaslimit/block.> No different from how the oil price is keep artificially high in many countries 

This seems really different to me actually: These high prices are due to taxes applied at the time of the sale, unrelated to market forces (which is what will determine the price of ether)

> isnt it theoretically possible that those who hold ether could decide to keep the price artificially high and thus affect the price of conducting business on ethereum?

This is a classic ""Prisoner's Dilemma"" situation. Yes, if EVERYBODY who owns ether refuses to sell it, you are right that prices could be kept artificially high. However, it would be in the interest of any individual holder to cash out their ether in that situation to reap an enormous profit. The hope is that ether will be distributed widely enough that this type of ""cartel"" cannot form and that we will instead have an open market.

With an open market, price manipulation is very difficult. I'm pretty certain that 99% of the time when people complain about bitcoin or gold price manipulation they are just complaining about losing money and have no evidence of actual manipulation to back up their claims.

(In the stock market price manipulation is more rampant, due to the availability of lots of insider information, but that does not exist to the same extent with ether or Bitcoin)I'm not an economic expert but Oil is consumed when it is used - ether is not."
2014-12-04 09:46:45;The logistics of mining (regardless of algorithm;
2014-12-04 03:59:54;Mining Ether should be included in the MIST Ethereum Browser.;"My impression was that this is already the plan (though I'm only an outsider and don't know for sure)I like it a lot. That would lower the barrier to entry for the average person.Sorry i didn't answer before, I've been away for a few days. 

Mist is a end user browser, so the question of it will include mining depends ultimately if a end user can actually mine in a home computer. We might even do a test to determine if the users computer is able to do it or not. I believe the experience of having ""mining turned on"" but never getting any reward is worse than not having mining at all.  

But ultimately your question is about how users can get started with ether and that's am definitely something we worry about. We intend to include, in the signup process, a link to all or most of the dapps that can do that, like:

* hard disk space renting (IPFS)

* VPN as services (Lantern project)

* CPU markets (Golem Project)

* artificial artificial intelligence services  (Mechanical Turk)

* Any kind of faucet or giveaway project that seems fair

This depends ultimately on the community having those ready as soon as possible. As with all the dapps on our starting screen, the list will be updated constantly..
This would be absolutely amazing. It would take the 'scary' element of mining away entirely (for less-techy people).Another even simpler implementation may be to have a ""mine ether"" button link to the download page for the full node client. Ether way, it should be made as easy as possible for casual users of the Mist browser to contribute spare CPU cycles to secure the network, obtain ether, and increase adoption.  https://api.monosnap.com/image/download?id=tQ9SEL0YGLtA8o0FT5BHOpugQxvTpF"
2014-12-11 22:42:59;Could we exchange bitcoin/ethers by using the browser ether from the genesis block?;Gavin has worked on a decentralized exchange demo dapp, the early API of which can be found at https://github.com/ethereum/cpp-ethereum/wiki/Exchange-API. To be clear, this is just an open source sample of what can be done, as the network itself is feature-less by design  (https://github.com/ethereum/wiki/wiki/Design-Rationale).
2014-12-11 21:45:26;Szabo mentions Ethereum. Again.;">Recently developed and developing technology, often called ""the block chain"", is starting to change this. A block chain computer is a virtual computer, a computer in the cloud, shared across many traditional computers and protected by cryptography and consensus technology. A Turing-complete block chain with large state gives us this shared computer. Earlier efforts included state-machine replication (see list of papers linked below).  QuixCoin is a recent and Ethereum is a current project that has implemented such a scheme. These block chain computers will allow us to put the most crucial parts of our online protocols on a far more reliable and secure footing, and make possible fiduciary interactions that we previously dared not do on a global network  > But the limits of Bitcoin's language and its tiny memory mean it can't be used for most other fiduciary applications, the most obvious example being risk pools that share collateral across a pool of financial instruments.

Can anyone translate this into a concrete example?"
2014-12-11 20:50:10;Ethereum and Evil;"Your question hits a deeper question beyond Ethereum -- rather it's a question about being digital in itself, and being on a network. 

Forget these fancy 2.0 movements - you don't have to look past the current web. If you really wanted to and looked hard enough, you will find all these nasty things you mentioned, and more. You upload the schematics for a 3d-printed gun once, your site will get taken down - but have they *really* taken it down? Same goes for nude pics, government leaks....Bytes are trickier than atoms. And that's all without Ethereum!

So this isn't a hard answer really, but rather just a musing -- we live in interesting times. The record/film industry had to adjust as it faced its new digital reality -- still is, but they're slowly finding their way. What I do have a sense of is, is that this train will not stop. It's scary because we're facing an unknown. We'll have to adapt and make sense of it as we go along.Like other crime in society, the public will be isolated from it by default - they don't want to see that. Authorities et al will try to fight it by whatever means are sufficiently palatable. It'll be easier for the internet public to witness crime, which will probably make them uncomfortable. It probably won't make crime much easier for professional criminals, either, but if it does that'll reduce their profit margins, although the volume might increase. The real question, though, is if we can stop people from using ethereum to fund roko's basilisk. I typed a longer answer but it was lost in the airport wifi limbo. Is in short:

* You can't have secrets in the blockchain, so any ransom that needs to only reveal a key under conditions isn't yet possible. 

* Undeletable information is already a reality with torrents. Try to take down the leaked  celebrity nudes or the 3D gun designs if you don't believe it. 

* You can have some evil uses with crime contracts that are bets that reward of something bad happens, but the problem is that those are undistinguishable from normal insurance contracts. A contract that gives a reward to someone if a third party dies is a terrible crime of the two parties are political enemies, but actually a very advisable contract if the two parties are spouses buying life insurance. To distinguish the two you'd have to lose anonymity and measure intent, which are undesirable and impossible 

* Finally there is the possibility of an evil DAC, a contact which automates some sort of criminal organized activity. But for those to work the whole untested concept of DACs have to work, and if these do it means that you can realistically replace governments entities and big corporations, in a more efficient manner with a transparent contract, a sort of automation of the top executives instead of the bottom workers. If that's true then it means that Ethereum will change society in both good, bad and unpredictable ways. It may be useful to approach this question from the opposite direction: In what ways might Ethereum improve the effectiveness of law enforcement agencies?

* Blockchain-embedded investigation logs
* Reduced administration
* Computational power and related services available to state and local agencies for breaking encryption
* Securely distributable criminal databases 
* Autonomous dash-cams identifying and reporting number plates, faces, etc
* Digital management of jurisdictions for more seamless inter-agency coordination

At a more systemic level, we might look at laws and punishments as structured incentives. Digital, programmatic laws and punishments can be more responsive to human behaviour - somewhat nearer to being immediate, proportional, and scientifically designed. I suppose you hit on one of the worst there alright in your OP- child abuse/pornography. I suppose Ethereum wouldnt exactly enable that, it would just make it a little harder for our current legal and policing systems prevent (which of course they should, could and will continue to punish). 

Interesting video posted today of a talk Gavin gave, in which he kind of explains that it will necessitate authorities to go after law breakers directly rather than through the service providers they use to do whatever they shouldn't

Also things like organised crime, hit man service, drug deals, insider trading, fraud, money laundering, political corruption, tax evasion.

Most ""evil"" uses of Ethereum are just quick ways to empty the account of the would-be evildoer.

But it's great that we're at the moral panic stage of the adoption curve. ;-)Perhaps it would be more productive to have more sense of what is not possible than speculate what might be possible?

Could a disruptive script be written that affects other scripts?.. If that's possible then you have potential anti-virus or anti-evil.. the limit of that being that such a script needs to be paid but so does all law. If it's not possible to disrupt a script, then surely the network could be at risk from a well funded evil script or the reputation that the network would aquire?.. and would the devs or the consensus that is society tolerate that?.. or would they simply clone a better version that did limit evil - if only through vetting and licensing or plus ability to disable scripts.

For all the uber liberal backing, it's typically only a fraction of society that would support such a network..???> instructions for ultra-cheap biochemical weapons

No such thing.

> After all, people are already 3D-printing guns.

No, they don't. It's a gimmick.

> Or just indelible public records

Oh my, I'm shivering in my boots. Ever tried something deleted from the Internet?

> would the entire blockchain have to come down?

Nah. Just take off, and nuke Earth from orbit. It's the only way to make sure.

> Sorry to be so nasty, but what bad things could people do with Ethereum?

Nothing they couldn't have done in the the first place. It's all just information."
2014-12-11 15:17:05;The Telegraph: Soon, the internet will be impossible to control;And fuck yes for doing so. All hail decentralization. Now all we need to do is figure out how to get rid of the governmental parasites - throw out the bums and replace them with... Nothing. Great article. It seems so difficult to cut through the crap and actually find intelligent articles that everyone can understand. Good job telegraph.
2014-12-11 12:31:12;BITTORRENT MOVES TO DECENTRALIZE THE WEB;
2014-12-18 23:59:48;A call to all the bug bounty hunters out there...;"It's just for the Go version for the time being, yes.
Please be aware as I wrote that protocols and Go client are still subject to change. Detailed rules and guidelines will be on the official bug bounty website that's to be launched soon.
Happy bug hunting! :)That's a great idea. Its just for the Go version right? Not Althzero1 BTC = 100,000,000 Satoshis; 
1 BTC = 268 euro; so a 11 figure satoshi, 10,000,000,000, would be 26,800 euro - which seems a bit big, maybe I've made a mistake? 11 figure Satoshi rewards!  That's what, one-tenth of a kilobitcoin?"
2014-12-18 12:02:41;Gav’s Ethereum ÐΞV Update IV;
2014-12-18 05:31:26;Ethereum roadmap - status and timelines?;"From a thread a couple of days ago Vitalik said, 

""Ethereum's focus is currently on:
     Get the blockchain out,
     2.0 scalability research,
     Whisper,
     HLLs and IDE,

Roughly in that order of priority. Swarm is out-of-scope, we did take the community's advice from that standpoint.""

Hope that helps (I'm not affiliated with ethereum in any way, just quoting)An easy way to keep up to date with what is currently being developed is to check out the blogposts at:https://blog.ethereum.org/ The dev updates by Gavin there give a pretty good picture of what we are doing at any given time.Learning all the lessons that were learned by Bitcoin."
2014-12-18 01:34:10;Ethereum VM magnet defunct?;"You can still get peers from DHT.
I see 5 seeds there, and I'm also seeding now.
Go ahead and try!We have a dedicated seeder, and I am also seeding on my laptop and can see peers and seeders. Might be a problem on your end?
I'm currently downloading it from the DHT.

Is there a working tracker I could add so you could find me? Public BT trackers seem to live short and hectic lives...

EDIT: I've added ""udp://open.demonii.com:1337/announce"" as a tracker and it seems to be working.

Try this updated link: magnet:?xt=urn:btih:524badd3fc667452dde3e7a72f67b86d261aaae8&dn=Ethereum%20VM&tr=udp%3A%2F%2Fopen.demonii.com%3A1337%2FannounceThank you everyone for helping.
I guess it must have been either my connection then (although I tried VPN-ed and off) and/or my work laptop. I am glad the seeding is going strong :)"
2014-12-17 22:37:54;Join Epicenter Bitcoin and Vitalik Buterin for a discussion on ‪‎Ethereum‬ , ‪Proof of Stake‬, and the future of ‪cryptocurrency‬. (Sunday, 6pm UTC / 10am PST);"Hey guys, Sebastien Couture here, co-host or Epicenter Bitcoin. Hope to see a lot of you in the hangout tomorrow. 

Here is the link: https://plus.google.com/b/117974047075526883919/events/cja5qlgg0pvjj75eehirv1a6brs

We will dive deep into Proof-of-Stake, Proof-of-Work, Bitcoin, Ethereum and the cryptocurrency ecosystem of the future. Let us know if you have any other topics you would like us to cover or questions you want us to ask!Cool, will try and join!"
2014-12-24 17:04:34;Congratulations Vitalik for making it to #4 on the LSDP Top 100 Global Thinkers of 2014!;Congratulations! The year of Ethereum in just one week.Good job V. You desreve it!!Congrats!!!i prefer awards to happen after genesis block.
2014-12-24 07:22:37;I did an icon set for ethereum because I think it's really cool. Hope you like it :);Beautiful :D[deleted]Super! Very nice work!Those are awesome!! I like [deleted]Good work!Those are cute :) 
2014-12-22 08:27:35;Epicenter Bitcoin interviews Vitalik Buterin: Ethereum, Proof of Stake, The future of Bitcoin;Great episode. Is there more info on the proposal of stable and volatility coins and an analysis maybe?
2014-12-22 07:29:51;Python-based Ethereum Package Manager for Serpent 2 contract deployment;Great work caktux! Awesome!!1!
2014-12-21 18:33:20;Decentralized Forum Solidity Contract: Advice? Help on the Front End?;I'll take a look at this tomo and message you once I understand it. I tools like a cool idea - and I need to up my solidity game!
2015-01-01 22:58:29;solidity syntax;"You're not the only one wishing for more solidity documentation. Pretty soon I'll be digging into the c++ code to start figuring out some basic things, including more clarity on functions (for instance, is recursion permitted?)

Edit: I want to point out though to whoever is working on the solidity syntax that I'm overall pleased with the design, I think it's a good approach with lots of promise.BTW, contract publishing in AlethZero seems to be broken in the latest build.  Could you let me know if you get your contract to publish?

To compile your solidity code, just paste it into the data field of the transaction panel like you would Serpent or LLL.Oh Solidity, you make us all yo bitch :( There is no reference yet, thet tutorial is as close as it gets. For all features that exist, there should be a test in the [end to end tests](https://github.com/ethereum/cpp-ethereum/blob/develop/test/SolidityEndToEndTest.cpp).

*arrays*:
Solidity does not yet support arrays. As pointed out in other comments, mappings can be used as an inefficient replacement for arrays in storage. Netiher structs nor mappings can be passed to or returned from functions for now.

*calls to other contracts*:
Basically, you have to know the ABI specs of the contract you want to call, if it is an ABI contract. To do this, for now, you have to put an ""interface"" of that contract above your actual contract, just leaving the functions blank. The rest should be clear from the tutorial.
If it is not an ABI contact, you are left with callstring32string32 and callstring32, but it is planned to improve this (basically there will be just ""call"" and it derives the types from its arguments).To make an array, use a mapping.

e.g.  mapping (uint8 => uint) integers;  makes an array of size 256 (named integers) that maps to 256bit uints.

Not sure how to call another contract with arguments.  I was under the impression that methods are numbered, not named.  Maybe someone else can answer this.Solidity is currently under heavy development and so things are going to be changing fast. Documentation will come as soon as things stabilize a bit more.

If you want to look at examples of cutting edge code you can always look at our tests. I would recommend you looking at the end to end tests.
https://github.com/ethereum/cpp-ethereum/blob/develop/test/SolidityEndToEndTest.cpp

There you can see various examples of solidity syntax at work. A little bit of C++ knowledge may be required but if you stick to whatever is in the source string literals under each test you can see the actual solidity source text."
2015-01-01 18:01:47;Wishing all Ethereans a very happy new year! Let 2015 bring Ethereum mainstream!;
2014-12-31 23:48:27;Forbes Tech 2015: Block Chain Will Break Free From Bitcoin To Power Distributed Apps;Happy New Year Everyone! This article sums things up nicely. 
2014-12-31 10:55:42;"""On Silos"" by Vitalik Buterin - ethereum blog [direct link]";"Reposting this as the other one had that horrid, nasty iframe used to monetize other people's work. >Some people see cryptocurrency as a capitalist revolution, others see it as an egalitarian revolution, and others see everything in between.

That's why it's here to stay.Great post.  I agree.

I think I basically said this before, but I strongly believe that there can and eventually will be technology that facilitates not only universal systems interface but also systems definition and exchange of system definition.

Something like a virtual machine is a starting point for thinking about this.  For example, the system Ethereum uses or an LLVM or a Java VM.  Say you understand that.  Now go read about ""knowledge representation and reasoning"".  Check out the OWL Manchester syntax.

We should be able to describe our systems in a high-level general purpose machine processable way and automatically generate code in our favorite programming languages.  Having a common language to exchange algorithms and high-level definitions will make it possible to take advantage of technology in collaborations.  Without something sophisticated, powerful, and universal like that, even when the programmers and next-gen economists stop arguing, they still will have to sit there and stare at specifications and semantically useless REST APIs and manually interface and implement.  Or if someone happens to implement a component in a programming language that is not their favorite, they will have to manually port or interface with it.

This is not in any way a new problem.  Its not an easy problem to solve.  I believe it has been a largely unrecognized and massively neglected problem in computer science.

Without the systems being able to communicate with a common language, we will always have to rely on human programmers to slowly and unreliably translate.

Most programming languages have MUCH more in common than people realize.  Most of the cryptocurrency concepts have not changed that quickly.  But there is no standard way to describe them that is machine processable.

I believe you want to start at a higher level than algorithms in many cases actually.  The algorithms often describe how to achieve something, but just as important is having a way to understand WHAT they are trying to achieve.

The solution is NOT to build all of the low-level components in C++.  I could have gone along with that in the 1980s, but its 2015."
2014-12-31 08:03:51;SchellingCoins in practice - would appreciate comments;"It sounds like you're thinking in a sensible direction, but some initial comments:

> you'd have to run another program to get the required data.

So, the idea behind SchellingCoin is that you DONT need to get data from the outside world... Are you saying the contract is a schellingcoin contract, with a schellingcoin-style API, and that you are giving users an additional program (NOT schelling-style, since it interacts with the outside world) that feeds data into the contract? So does that mean the contract will reward those people who's datafeed resembles the mathematical mode? (i.e. the most common value, i.e. hopefully the ""real"" value)

> Of course, there may be rogues, but that's the inherent nature of the SchellingCoins approach.

OK, suppose there's 1000 honest users participating... how do you prevent a SINGLE rogue from firing up 1001 docker containers, linked to 1001 separate anonymous ether wallets? If your answer is ""it would be too expensive to do so"" realize that this would significantly hamper the utility of your schellingcoin system, since it's primary purpose will be to execute financial contracts that ideally involve significant sums and provide lots of incentive to cheat.

(Not trying to knock your idea, I agree something like what you describe could probably serve a valuable role, I'm just trying to understand myself how big that role can be...)> The users receive a vagrant/docker machine ready for action. The advantages of vagrant/docker are isolation and the ability to deploy on cloud platforms immediately.

This all seems overly complicated.  If you don't mind using dockerhub, couldn't you just push a container there, and just do `docker pull <repo/container> ; docker run <repo/container>` ?"
2015-01-08 16:08:56;Ethereum ÐΞVcon-0: The Path to the Ethereum Light Client;Hi, in POS, how does a light client know that the stakeholder mining a new block has the stake needed to perform the mining? Will the miner supply a merkle proof of their stake holdings along with the info describing the new block?
2015-01-07 15:47:05;Device democracy : Saving the future of the Internet of Things (IBM white paper mentioning Ethereum);"Well, ""mentions"". We're on footnote 15 for those who missed it.. 😜 I was expecting a new paper? This has been out for a while.Internet of Things is the worst fad in history and NSA's wet dream. 

Imagine your insurance agency having acces to your heart rate and body fat index trough tour bathroom scale and then upping your car insurance because of your increased risk of heart attack. 

IoT makes every device uniquely identifible across the net. It is much worse than posting your fingerprint online."
