date;submission_text;comments_text
2016-09-15 20:10:53;Coindesk: Vitalik Buterin to Debut Ethereum Scaling Paper at Devcon;"Smarter is all relative VB.. You of all people know this. Don't sell yourself short dude! I'll change my Reddit handle if that helps:)Boom! No surprises but I'll be glued to r/Ethereum for the YouTube video!For better or worse I'll invest in anything this guy does.  Pure genius at work hereI'm a bot, *bleep*, *bloop*. Someone has linked to this thread from another place on reddit:

- [/r/ethtrader] [Vitalik Buterin to Debut Ethereum Scaling Paper at Devcon](https://np.reddit.com/r/ethtrader/comments/52y4o8/vitalik_buterin_to_debut_ethereum_scaling_paper/)

[](#footer)*^(If you follow any of the above links, please respect the rules of reddit and don't vote in the other threads.) ^\([Info](/r/TotesMessenger) ^/ ^[Contact](/message/compose?to=/r/TotesMessenger))*

[](#bot)Wait, there are people smarter than Vitalik?The paper was already put online a couple of days ago. Nice try."
2016-09-22 23:59:54;ConsenSys from Demo Day: EtherLoan;What about managing the risk of no repayment?
2016-09-22 23:57:42;Stuck at block 2,306,067;"Just leave it alone and wait.  My node was having a hard time getting past those blocks too, but it finally did.

http://i.imgur.com/0JFuJpK.png[deleted]"
2016-09-22 22:55:00;Just download my Ethereum wallet the 0-8-3 version, Can´t create an Account;Is your wallet already synced? I think I had this problem a time ago, when my wallet wasn't synced, but then it appeared.
2016-09-22 22:23:42;Made several transactions with ShapeShift, ether disappeared?;"Well, you're not alone. I'm having this issue as well.contact their supportI had similar probs today sending ether from jaxx to some exchanges. Very weird things going on, tx's weren't showing up all day. Had to reset the cache on the jaxx wallet multiple times for each send, finally they went through recently, but enough to give me mini heart attacks all day. It probably was due to the network attack 

Etherscan was out of sync  "
2016-09-22 22:07:31;Ethereum Faces another DoS Attack;
2016-09-29 23:35:43;PLUTUS: Contactless payments set to surge;I don't see anything about plutus in this article, but I know plutus is going to use contactless payments.
2016-09-29 23:24:56;Cash on the live blockchain by Santander and <ether.camp>, Virtual Accelerator updates and much more: Our DevCon2 summary.;"I am curious what is the timeline we should be expecting for the cash on the Ethereum blockchain.The Virtual Accelerator, so you are issuing a new coin ? ""Other major banks are now approaching us and are asking to be part of an initiative that is putting cash money on the chain.""

Out-Freaking-Standing!"
2016-09-29 23:20:21;Vlad Zamfir: Post DAO fork lessons for Ethereum & Classic, from lead Casper researcher;"What is meant by ""whatever is best for the clients"" ?"
2016-09-29 22:31:41;Parity error - Ubuntu 16;
2016-09-29 22:27:03;Mist Failing to Complete Blockchain Download;"same issue on testnet, not on mainnet..working on mainnet only and syncing on testnet in my sparetime..will let you know if successfulso basically i did the following:
1) sync chain on mainnet
2) move to testnet Develop menu/tools/testnet (Morden)
3) Mist menu/quit Mist
4) Open Mist Application, let it sync completely without launching the application
after a few hours sync was completed and by switching between mainnet and testnet everything seems to be working fine..basically it downloaded the chain twice for testnet and the testnet chaindata file is 21.1GB which is probably twice the size of the chain"
2016-10-06 23:32:53;Exodus Crypto Wallet / Hard-Fork To Stop Attacks / XMR Entry Time;
2016-10-06 22:56:27;Non-genesis account had positive balance (no mining or receive TXs) before first send TX. How's that possible?;"maybe some contract internal tx you didnt notice?I'm running some analysis on the blockchain and hit an assertion in my code that was triggered by this account.

It looks to me like this account is a non-genesis account (at least it's not on the list I have), it started with a positive ETH balance, and never mined any blocks solo.

Any ideas?

Thanks.You mean 0xa526? There's an internal transaction preceding that 2000 ETH out to Polo"
2016-10-06 22:52:58;The Credit Commons;
2016-10-06 21:17:25;Will PoS mining be possible with a separate dedicated private key?;Some form of multisig will be necessary especially if staking nodes on cloud hosts is a must due to network connectivity / downtime.paging /u/vbuterin
2016-10-06 21:06:14;Russian Central Bank and Ethereum;na zdarovye!This even looks like it's a public chain project! Noice!Hourra!the return of Mastercoin
2016-10-13 23:26:46;Ethereum Decentralized IoT;"I know these guys are http://www.chronicled.com/http://www.chainofthings.comhttp://slock.it is onewe're doing, under progress.
http://trustfarm.io
"
2016-10-13 22:42:17;Can someone explain the second hard fork?;If the attacker puts 1 wei in the account, they would have paid the tx fee and it would be absolutely legitimate.  But this is not what happened.  To create the billions of accounts with 1 wei would have cost him a huge amount of money- nothing stops anyone from doing this except the transaction fees. Normally creating an account costs 25,000 gas, so if the attacker was to create millions of 1-Wei accounts after the fork it'll cost him a very large amount of money to do so.~~This will not be the second HF.~~2nd hardfork was the DAO-Hack thingy. We are now talking about number 3 and 4. First was Homestead.Reminder: It's not the second, it's the third. And it's an update not a contentious fork.
2016-10-13 22:41:01;5 Blockchain IOT Applications;Great job on this white paper, there are some really terrific concepts here, blockchain and IoT will be hot in 2017, exciting to imagine so many innovative use cases! :) 
2016-10-13 21:59:47;ETH Hard Fork Question: Will this result in the same kind of duplication in wallet coins à la the ETH/ETC split in July?;"Not likely. This one isn't about morals or community opinion or right and wrong, it's a protocol fix. Some functions cost more computationally than they do financially, and this is fixing that.Only reason there was a second currency created last time was because there was an economic incentive to mine the new chain.

With updates to the protocol this time around, there won't be any reason not to use the newest version.
no, why would it?This will likely be similar to the hard fork that happened when Ethereum upgraded from Frontier to Homestead. I don't think any users noticed it at all, because the miners and exchanges all simultaneously switched over to Homestead and nobody continued to run Frontier. There was no reason to - Frontier was just objectively worse than Homestead.

With the DAO there was no clear-cut ""this one is better, that one is useless"" conclusion. So some people continued using each branch of the fork.Wondering the same thing"
2016-10-13 21:43:28;Ethereum Foundation announcement of imminent hard fork for EIP150 gas cost changes;
2016-10-20 23:47:31;Mist UX;"Im a QA Engineer, and i Completely AGREE with your points. Unless your a computer techie, its nearly impossible to use. 

Part of the reason why i haven't installed MIST. Waiting for it to be updated before using.


Sorry about these problems. We switched to using electron-builder to build installers for all platforms and by default for Windows it uses ""squrrel"" as it's installer. We're now working on using a different installer. In the worst case we can simply go back to using ZIPs.

Note that many of the devs (myself included) don't use Windows, and so we just assumed that the current installation flow was the standard Windows one.I agree. I'm not very smart and what you just described addresses things I've noticed in my noobish ways.  Thank goodness I knew about the hidden folder part.

I think for commoners like me it would be nice if it installed with options that the user can decide just like any other product.  Except I don't want it to try and offer me the all new Edge browser and Yahoo toolbar.  LolThe Ui experience is surely less important than the back end at this point, it makes sense for the EF to concentrate on that right now.  I'd suggest demoing myetherwallet and metamask.  Even better, show them the nano ledger s.

I agree completely. I found the lack of installation directory options very weird and annoying. I had to go find the folder manually. And it wasn't where my old copy was. So it screwed that up for me.I completely agree with all those points. It's a pretty terrible user experience. Why on earth is it in AppData? It would be great if I could select where to install and where to put my chain data too.Agree with this. I complained sbout this a couple of weeks ago as well.I completely agree. If I'm about to download 30gb worth of blockchain, I might not want to install it into my appdata folder on my main drive, and could rather use a different directory on a different drive.I have to admit the OP did some points here. I recently started mist on Linux to look up a feature and was greeted by a splash screen telling me ""Upgrading binaries"" without any way to confirm or interact. I really do not want that mist is tampering with any binaries on my machine, give the users a little bit control.

I know it's for convenience, but some users like to have control over what's happening with their machines. Same also applies for building mist from source. It's currently not possible to build mist from source without downloading geth binaries through a gulp script. I already have geth build from source, so I do not require those binaries either.

In the end I just go to localhost:8080 to use the parity version of ethereum-wallet because I have that under control. It's a bit more unstable for now but works for the most parts.Exactly, would love a return of the zip for Windows, please!Same happened with Etherum Wallet for Linux.
  I used to extract the zip and have everything in my /Home directory. Now Geth unpacks itself in .config (hidden) /home/user/.config/Ethereum Wallet/ binaries/Geth/unpacked/geth 
Thankfully we won't have to put up with the Ethereum Foundation code garbage for very long since the EthCore guys seem to be picking up the slack with the Parity UI.  I'm all for free market solutions to the EF problem.  Quite a few false statements in this post. It reads like you are doing things left for last minute for your meetup due to lack of planning and you are just venting on this forum.  Latest versions of EW and Mist created shortcuts on my Win 10 desktop.  Latest Geth versions are always available at: https://github.com/ethereum/go-ethereum/releases

And I don't have the patience to respond to the rest. Do your homework.

"
2016-10-20 22:59:56;New to Ethereum (and cryptos in general), I'm having some trouble creating a wallet contract in the Ethereum Wallet GUI.;You are not doing anything wrong. The problem is that due to recent attacks the gas limit was lowered and you can't deploy this wallet.  Should be fixed relatively soon. But there is no danger in keeping your ETH in a regular account as long as you backup the keystore file and password. The wallet contract is really only if you need multisig. Do you have a balance of at least 1 ether under the account establishing the contract?
2016-10-20 22:42:40;Best way to split ETC/ETH?;"I don't now it's the best way, but I did it with...

https://www.myetherwallet.com/#help

Look under number 6"
2016-10-20 22:34:28;Since fork, are Dapps now more expensive to run?;Its going to depend on the contract - I checked the cost to make a bet on Rouleth pre and post- fork- the gas changed from 149815 to 152215 about 1.6% increase - I expect this is typical -less than $0.000001 at current gas pricesWhat's a good list for running dApps?Not by any significant amount.  Only the attacker was making heavy use of these expensive opcodes - most well-designed contracts will use them sparingly.
2016-10-20 22:04:50;Reminder: Even if you sent Ether to Coinbase AFTER the hardfork, you likely still have a ETC balance on Coinbase. Sign in and go here to ensure you don't have a balance left over. I did.;
2016-10-27 22:39:32;Is this a valid way to create a brain wallet?;"I believe both bitcoin and ethereum use the same ECDSA private key format, so it should work.

Most people do not recommend using brain wallets though.Yes, this is correct. I've done it (and have also spent from an ETH brainwallet created like this).

This hex priv key is the SHA256 hash of your passphrase. This might be a useful info in case you want to double check by recreating the brainwallet also from another source.

And of course, make sure you do an extremely good job on the entropy of your passphrase.you shouldn't (as in really, really shouldn't) create a brain wallet today - see https://rya.nc/forensic-bitcoin-cracking.html

the only reason why it still works is probably because there are no sniping bots on the Ethereum network *yet*"
2016-10-27 21:25:14;Ethereum hashrate to drop when zcash is released?;"Don't guys think that zcash is a bit too centralized?. I mean founders getting 20℅ of coins. Idk is just don't have that total freedom that Bitcoin had back in the early adoption days.The mining hashpower change depends on the rewards change in the short term, and also on improved hw in the long term. Unless ether falls in value, hashpower will not decrease.Made .24+ BTC today by switching over and utilizing all my CPU power as well. Thanks zcash ;) They'd need openly-available GPU-based miners, first :)"
2016-10-27 20:24:37;the branche broadcast - branche design chat with Logan;
2016-10-27 20:09:55;An Ethereum Powered Mobile App for p2p Check Cashing and Payday Loans;When's the launch date for this? Will this be only for American and Canadian clients?
2016-10-27 18:54:27;A Deep Dive into the Colony Voting Protocol @Devcon2 - Dr. Aron Fischer & Elena Dimitrova;It's a shame slides aren't visible on any of the presentations... :(
2016-11-03 23:16:30;Instruction of Using Parity with Mist on Ubuntu;"To use Mist wallet:

run ""parity --geth"" then start Mist wallet, which will detect parity running and use it.

To use web ui:

run ""parity"" and open 127.0.0.1:8080 in your browser.> I only found how to run parity, but how to use it? Like create wallet, run web ui, run with Mist wallet?

Open http://127.0.0.1:8080/ in your browser after starting parity. Mist is rather duplicated functionallity unless you need the _browser_ not the wallet. But I think parity 1.4.x will include a Parity _browser_, too.

BTW, do you know [Ethereum Stack Exchange](https://ethereum.stackexchange.com) already?"
2016-11-03 22:29:47;Will the current craze of Initial coin offerings end up in a big crash?;There are some good projects and some bad ones. Some will definitely fail. All it takes is one to succeed.  but I don't think they will rise and fall together.  The projects are too heterogeneous to be grouped together. I am worried that we will end with a huge crash – like we had in dotcom era – and that would push the development of legitimate blockchain uses back a few years.
2016-11-03 20:17:47;China Bitcoin Restriction / Ethereum Fork in Two Weeks / Brexit Slowdown = Market Gains;[deleted]
2016-11-03 20:07:15;Ethereum-based Inchain - a Blockchain Insurance Platform Raises $130,000 in First Week of ICO;I have no idea why anyone would downvote news about Eth projects getting funded, we are building out the ecosystem one quality ICO after another.
2016-11-03 20:05:29;Microsoft Rolls Out Its Cloud-Based Ethereum Consortium;Interesting that there's no mention of cryplets in the article. This is one of the key pieces of project Bletchley which they spoke about at devcon2. 
2016-11-10 21:48:44;Golem crowdfunding contract deployed, start block is 2607800. Details here.;"good luck!Woohoo, here we go people!Could you please remind me are the coins going to be tradable on exchanges? I would like to slowly accumulate some.I'll throw some money at you, don't disappoint me please!best of luck with this. I'm in! lets do this!Syncing up my wallet in advance, in case it's a quick sale.

If you can't sync, try parity 1.4.2 with
> parity --warp uiI encourage everyone interested in the ICO to request Polo trading: https://poloniex.com/coinRequest[deleted]And it's over already!  The contract has already raised its 820,000 ETH cap!And we will be thankful for spreading the word: https://twitter.com/golemproject/status/796832167812677632[deleted]Below lines in the contract force the last participant to send EXACTLY the remaining amount of ETH to the contract address (if he wants to be the last one). In case he sends just a small amount more than allowed his tx will be aborted. Couldn't you just count in the remaining allowed value and send back what is left to msg.sender?

if (msg.value > (tokenCreationCap - totalTokens) / tokenCreationRate)
            throw;
n order to participate in the Golem crowdfunding, you need to have the latest version of Mist, Ethereum Wallet, or Parity-

Does this mean that metamask wont work or what?[deleted]wow, cap is coming!So how long till this one blows up like the dao and we have to hard fork"
