username;date;retweets;favorites;text;geo;mentions;hashtags;id;permalink
ezonobia1;2013-09-15 01:57;0;0;"" @msnbc : . @upwithsteve looks at how the 9/11 attacks have had a ripple effect on the politics of the last 12 years http:// on.msnbc.com/14QqLfU "";;@msnbc @upwithsteve;;"379031176360787968";https://twitter.com/ezonobia1/status/379031176360787968
alphonsoelm;2013-09-15 01:56;0;0;"I just liked " Ripple - "The Future of Money"" on Vimeo: http:// vimeo.com/74181839";;;;"379030997213671425";https://twitter.com/alphonsoelm/status/379030997213671425
MaseehaMather;2013-09-15 01:56;0;0;"@shahnaaz_b If a bunch of midgets do the wave... Would it be called a ripple ? :p";;@shahnaaz_b;;"379030865822908416";https://twitter.com/MaseehaMather/status/379030865822908416
SiriusNews_com;2013-09-15 01:54;0;0;"a new viral app coming out. Photo Guessaroo. http://www. startmyripple.com/blitzlink/9d77 335e135c0983e4f7949a23e00482 … come join my ripple";;;;"379030534523191296";https://twitter.com/SiriusNews_com/status/379030534523191296
FanYourFlame;2013-09-15 01:54;0;0;"@roopnishka Thanks for following & for spreading encouragement with all the RT's! So very glad ur a part of The Ripple Effect Community!";;@roopnishka;;"379030439538593793";https://twitter.com/FanYourFlame/status/379030439538593793
NowYouBeYou;2013-09-15 01:54;0;0;"Were U slow getting on #Twitter and #Facebook ? Don't make that mistake w/ #Ripple http:// yesfreedom.blogspot.com/2013/09/start- your-ripple.html … Start your #Ripple , start earning.";;;#Twitter #Facebook #Ripple #Ripple;"379030414624432128";https://twitter.com/NowYouBeYou/status/379030414624432128
SkylarMorgan18;2013-09-15 01:52;0;0;"My dad just said "I want to see @dankanter play ripple " out of nowhere";;@dankanter;;"379029964391464960";https://twitter.com/SkylarMorgan18/status/379029964391464960
allyson_ripple;2013-09-15 01:49;1;0;"When people can't fight their own battles <<";;;;"379029208124915712";https://twitter.com/allyson_ripple/status/379029208124915712
chefmarjie;2013-09-15 01:47;0;0;"Winter salad of roasted squash and figs @Ripple http:// instagram.com/p/eQoCgHqsSk/";;@Ripple;;"379028660264914944";https://twitter.com/chefmarjie/status/379028660264914944
MSNBC;2013-09-15 01:45;6;1;". @upwithsteve looks at how the 9/11 attacks have had a ripple effect on the politics of the last 12 years http:// on.msnbc.com/14QqLfU";;@upwithsteve;;"379028069400735744";https://twitter.com/MSNBC/status/379028069400735744
NowYouBeYou;2013-09-15 01:43;0;0;"Ripplin' cool fun. How far does you influence travel? You can make a difference. #Ripple http:// yesfreedom.blogspot.com/2013/09/start- your-ripple.html … #socialmedia Gone #Viral";;;#Ripple #socialmedia #Viral;"379027683704721408";https://twitter.com/NowYouBeYou/status/379027683704721408
snarlsbukowski;2013-09-15 01:40;0;0;"The world should ripple when you shout, and yet when you go to, it only echoes.";;;;"379026941342281729";https://twitter.com/snarlsbukowski/status/379026941342281729
jrb0359;2013-09-15 01:37;0;0;"Ugh. Ripple effect... #keeponkeepinon";;;#keeponkeepinon;"379026156738969601";https://twitter.com/jrb0359/status/379026156738969601
Linda_Durbesson;2013-09-15 01:37;0;1;"Photo: Every act of kindness has a ripple effect. You never know who will be touched by your positive... http:// tmblr.co/ZyCEhvv2ov87";;;;"379026059523813376";https://twitter.com/Linda_Durbesson/status/379026059523813376
Rory_Jackson08;2013-09-15 01:35;0;0;"If a bunch of midgets do the wave, Would it be called a ripple";;;;"379025696829734912";https://twitter.com/Rory_Jackson08/status/379025696829734912
ToysDiscreet;2013-09-15 01:35;0;0;"Cascade Ripple Single Sheath - Pink http://www. Discreet-Adult-Toys.com/Vibrators/G-Sp ot-Clit-Stimulators/Cascade-Ripple-Single-Sheath---Pink/sku-CNVELD-CSR003 … #Cascade #Ripple #Single #Pink #Sheath";;;#Cascade #Ripple #Single #Pink #Sheath;"379025600704286721";https://twitter.com/ToysDiscreet/status/379025600704286721
a_wabbs;2013-09-15 01:34;0;0;"" @MabeISimmons : If a bunch of midgets do the wave... Would it be called a ripple ?"Hahaha";;@MabeISimmons;;"379025369950855168";https://twitter.com/a_wabbs/status/379025369950855168
NowYouBeYou;2013-09-15 01:32;0;0;"What does it mean to #Ripple ? http:// yesfreedom.blogspot.com/2013/09/start- your-ripple.html … #socialmedia gone #Viral";;;#Ripple #socialmedia #Viral;"379024870975098880";https://twitter.com/NowYouBeYou/status/379024870975098880
lexie_jayy;2013-09-15 01:30;0;0;"was supposed to go out to ripple tonight.. that's a dummy mission! what's going on to tonight??";;;;"379024441532899328";https://twitter.com/lexie_jayy/status/379024441532899328
NowYouBeYou;2013-09-15 01:30;0;0;"Ripplin' cool fun. How far does you influence travel? You can make a difference. #Ripple http:// yesfreedom.blogspot.com/2013/09/start- your-ripple.html … #Viral #socialmedia";;;#Ripple #Viral #socialmedia;"379024351422476288";https://twitter.com/NowYouBeYou/status/379024351422476288
CamoGirl_62;2013-09-15 01:28;0;0;"Girls wearing leggings as pants and you can see every little ripple in their legs < they may be a little too tight on you";;;;"379023992503697408";https://twitter.com/CamoGirl_62/status/379023992503697408
talk_iListen;2013-09-15 01:27;0;0;"@Carmen_Jolene woah lol ..no it's not but it's saturday and it's in broad ripple lol";;@Carmen_Jolene;;"379023754162343936";https://twitter.com/talk_iListen/status/379023754162343936
NowYouBeYou;2013-09-15 01:27;0;2;"How far is your social reach? Got influence? Make a splash and see how far can your #Ripple go? http:// yesfreedom.blogspot.com/2013/09/start- your-ripple.html … Come join #Ripple .";;;#Ripple #Ripple;"379023681151721472";https://twitter.com/NowYouBeYou/status/379023681151721472
bbyyimi;2013-09-15 01:25;0;0;"disclaimer: last night no sexual events took place. just an amazing night. broad ripple . stars. new best friend. laying in a pickup. love.";;;;"379023190787239936";https://twitter.com/bbyyimi/status/379023190787239936
Mcthomas146;2013-09-15 01:23;0;0;"@JMV1070 convinced bar manager of triton tap in broad ripple to order mayweather Alvarez. U in?";;@JMV1070;;"379022598970953729";https://twitter.com/Mcthomas146/status/379022598970953729
_stefanispeed;2013-09-15 01:15;0;0;"At bagel ripple";;;;"379020714181140480";https://twitter.com/_stefanispeed/status/379020714181140480
EveJAdams;2013-09-15 01:13;1;1;"Congrats Dr Gopal Bhatnagar, former Chief of Staff @TrilliumHospital on tonight's Ripple Effect Award! #cardiachealth pic.twitter.com/OnKVbXX0f7";;@TrilliumHospital;#cardiachealth;"379019998657654784";https://twitter.com/EveJAdams/status/379019998657654784
SeanJac22480537;2013-09-15 01:06;0;0;"StuffStuff > Product > CRKT Aluminum Ripple Folding Knife http://www. stuffstuff.com/Product/tabid/ 88/productid/123/campaignid/136/Default.aspx …";;;;"379018464637120512";https://twitter.com/SeanJac22480537/status/379018464637120512
anthonyElove;2013-09-15 01:04;0;0;"I want to live in Broad Ripple .";;;;"379017918308024320";https://twitter.com/anthonyElove/status/379017918308024320
livingbetterme;2013-09-15 01:04;0;0;"Start a ripple effect. http:// fb.me/17LT9qNd3";;;;"379017756588658688";https://twitter.com/livingbetterme/status/379017756588658688username;date;retweets;favorites;text;geo;mentions;hashtags;id;permalink
BryanMartin68;2013-10-04 01:59;0;0;"The Ripple Effect: A Ripple Conversation with Butcher Babies - Mayhem... http:// ripplemusic.blogspot.com/2013/08/a-ripp le-conversation-with-butcher.html?spref=tw …";;;;"385917003698933760";https://twitter.com/BryanMartin68/status/385917003698933760
wyerstuff;2013-10-04 01:59;0;0;"Have you been invited to the #ripple yet? http:// bit.ly/13aG2W0";;;#ripple;"385916994438324224";https://twitter.com/wyerstuff/status/385916994438324224
BryanMartin68;2013-10-04 01:57;0;0;"The Ripple Effect: A Ripple Conversation with Jon5 Rob Zombie guitar... http:// ripplemusic.blogspot.com/2013/08/a-ripp le-conversation-with-jon5-rob.html?spref=tw …";;;;"385916647900315650";https://twitter.com/BryanMartin68/status/385916647900315650
OVVeterans;2013-10-04 01:57;1;0;"Shale exploration’s ripple effect expected to boost area economy http:// bit.ly/1buLJ79 #Veteran #Vets #Ohio It's all about #Jobs";;;#Veteran #Vets #Ohio #Jobs;"385916592489766913";https://twitter.com/OVVeterans/status/385916592489766913
BryanMartin68;2013-10-04 01:57;0;0;"The Ripple Effect: A Ripple Conversation with Badmotofinger http:// ripplemusic.blogspot.com/2013/10/a-ripp le-conversation-with-badmotofinger.html?spref=tw …";;;;"385916532573745152";https://twitter.com/BryanMartin68/status/385916532573745152
BryanMartin68;2013-10-04 01:57;0;0;"The Ripple Effect: WITHEM - The Point Of You http:// ripplemusic.blogspot.com/2013/10/withem -point-of-you.html?spref=tw …";;;;"385916487426273280";https://twitter.com/BryanMartin68/status/385916487426273280
BryanMartin68;2013-10-04 01:56;0;0;"The Ripple Effect: A Ripple Conversation with Eddie Trunk - Eddie Tru... http:// ripplemusic.blogspot.com/2013/09/a-ripp le-conversation-with-eddie-trunk.html?spref=tw …";;;;"385916399756922880";https://twitter.com/BryanMartin68/status/385916399756922880
perfect__gifts;2013-10-04 01:50;0;0;"Si-Fi Thriller: Beneath a Darkening Moon ( Ripple Creek) by Keri Arthur: http:// bit.ly/TrMKNN";;;;"385914794332532736";https://twitter.com/perfect__gifts/status/385914794332532736
_The_Doctor____;2013-10-04 01:45;0;0;"Doctor Who Keep Calm I'm the Doctor Womens http://www. shortvale.com/1fyzp #Calm #Doctor #Junction #Keep #Ripple #Womens";;;#Calm #Doctor #Junction #Keep #Ripple #Womens;"385913465325752320";https://twitter.com/_The_Doctor____/status/385913465325752320
Aarrinn_;2013-10-04 01:43;0;0;"I think this will have such a big impact the ripple has begun and will travel miles further @creekcharacter Go Creek! #beavercreekpride";;@creekcharacter;#beavercreekpride;"385913010545782784";https://twitter.com/Aarrinn_/status/385913010545782784
11_bmiller;2013-10-04 01:42;0;0;"@molltiply fuuuuck downtown! Broad ripple !!";;@molltiply;;"385912794433847296";https://twitter.com/11_bmiller/status/385912794433847296
BarbaraStanny;2013-10-04 01:40;0;0;"I truly believe, if enough women step fully into their own power, we’d see a giant ripple effect on the global landscape. What do you...";;;;"385912266472030208";https://twitter.com/BarbaraStanny/status/385912266472030208
janhenrydesign;2013-10-04 01:40;0;0;"No time to promote your business on Facebook? Get a "Done for You" package from Ripple X Marketing: http:// fb.com/ripplexmarketi ng …";;;;"385912255507746816";https://twitter.com/janhenrydesign/status/385912255507746816
j_ripple;2013-10-04 01:39;0;1;"@samm_Boehm haha thank you! love you too";;@samm_Boehm;;"385912018483806208";https://twitter.com/j_ripple/status/385912018483806208
samm_Boehm;2013-10-04 01:39;0;0;"@j_ ripple is the best....EVER! Love youuuu";;@j_;;"385911945120849920";https://twitter.com/samm_Boehm/status/385911945120849920
KayleeTonks;2013-10-04 01:36;0;0;"S9E13 Ripple Effect #StargateSG1 #GetGlue http:// gtg.lu/18AsZOC";;;#StargateSG1 #GetGlue;"385911305078853632";https://twitter.com/KayleeTonks/status/385911305078853632
ShitRachelSays7;2013-10-04 01:36;1;0;"It was a ripple in the ocean of true love #ShitRachelSays";;;#ShitRachelSays;"385911287265648640";https://twitter.com/ShitRachelSays7/status/385911287265648640
CRowensboro;2013-10-04 01:34;0;0;"Never doubt the impact of a simple act of kindness....the ripple effect can be powerful.";;;;"385910872578596864";https://twitter.com/CRowensboro/status/385910872578596864
servantofchaos;2013-10-04 01:33;1;0;"POV: the digital disruption that Pandora represents is yet to ripple through the media networks here #digfestival";;;#digfestival;"385910507825528832";https://twitter.com/servantofchaos/status/385910507825528832
tiling_stores;2013-10-04 01:32;0;0;"Sample W60 Gold Ripple Glass Mosaic http://www. shortvale.com/1fyx7 #$699 #Glass #Gold #Mosaic #per #Ripple #SAMPLE #sqft #Tile #W60SAMPLE";;;# #Glass #Gold #Mosaic #per #Ripple #SAMPLE #sqft #Tile #W60SAMPLE;"385910289033879552";https://twitter.com/tiling_stores/status/385910289033879552
devillygirl;2013-10-04 01:32;0;0;"Reading The Ripple Effect, by J.A. Saare: I know I'm supposed to be all excited about this book...and I would be I... http:// bit.ly/18Unrj5";;;;"385910187728465921";https://twitter.com/devillygirl/status/385910187728465921
x_ThaWIFE;2013-10-04 01:31;0;0;"Goin to Ripple homecoming tomorrow";;;;"385909983180623873";https://twitter.com/x_ThaWIFE/status/385909983180623873
San_Lawrence;2013-10-04 01:30;0;0;"Zona Boy Z - (Young Ripple , Docseus Hd,) http:// rdo.to/MAFIA #nowplaying #listenlive";;;#nowplaying #listenlive;"385909703609704448";https://twitter.com/San_Lawrence/status/385909703609704448
TaiSwagyPMason;2013-10-04 01:29;0;0;"One good deed is a ripple effect.";;;;"385909484365049856";https://twitter.com/TaiSwagyPMason/status/385909484365049856
Lifestyles_Ph;2013-10-04 01:28;0;0;"Today- go out of your way to encourage someone! Be extra kind today! Start a RIPPLE effect in the world filled with love & kindness!...";;;;"385909324578828288";https://twitter.com/Lifestyles_Ph/status/385909324578828288
AustBitcoins;2013-10-04 01:28;0;0;"Seeing the Ripple Effect on Money http:// lnkd.in/bSZuUpF";;;;"385909184861974529";https://twitter.com/AustBitcoins/status/385909184861974529
allyson_ripple;2013-10-04 01:24;2;0;"But I still care about you.";;;;"385908297477668864";https://twitter.com/allyson_ripple/status/385908297477668864
Pkittay1;2013-10-04 01:24;0;1;"I'm upset that Dari ripple is closed. I really want a slushie.";;;;"385908180804308992";https://twitter.com/Pkittay1/status/385908180804308992
ALinsdau;2013-10-04 01:22;0;0;"Watched grapple ripple across the valley till it hit the house. Glad I wasn't out in this on Paintbrush Divide.";;;;"385907750158344192";https://twitter.com/ALinsdau/status/385907750158344192
WorldHeartBeats;2013-10-04 01:22;1;0;"Are you in on the ripple ? 1 million people are in in 3 months! Worth a look. http:// tinyurl.com/m4rcjtv";;;;"385907734266138624";https://twitter.com/WorldHeartBeats/status/385907734266138624username;date;retweets;favorites;text;geo;mentions;hashtags;id;permalink
BryanMartin68;2013-10-04 01:59;0;0;"The Ripple Effect: A Ripple Conversation with Butcher Babies - Mayhem... http:// ripplemusic.blogspot.com/2013/08/a-ripp le-conversation-with-butcher.html?spref=tw …";;;;"385917003698933760";https://twitter.com/BryanMartin68/status/385917003698933760
wyerstuff;2013-10-04 01:59;0;0;"Have you been invited to the #ripple yet? http:// bit.ly/13aG2W0";;;#ripple;"385916994438324224";https://twitter.com/wyerstuff/status/385916994438324224
BryanMartin68;2013-10-04 01:57;0;0;"The Ripple Effect: A Ripple Conversation with Jon5 Rob Zombie guitar... http:// ripplemusic.blogspot.com/2013/08/a-ripp le-conversation-with-jon5-rob.html?spref=tw …";;;;"385916647900315650";https://twitter.com/BryanMartin68/status/385916647900315650
OVVeterans;2013-10-04 01:57;1;0;"Shale exploration’s ripple effect expected to boost area economy http:// bit.ly/1buLJ79 #Veteran #Vets #Ohio It's all about #Jobs";;;#Veteran #Vets #Ohio #Jobs;"385916592489766913";https://twitter.com/OVVeterans/status/385916592489766913
BryanMartin68;2013-10-04 01:57;0;0;"The Ripple Effect: A Ripple Conversation with Badmotofinger http:// ripplemusic.blogspot.com/2013/10/a-ripp le-conversation-with-badmotofinger.html?spref=tw …";;;;"385916532573745152";https://twitter.com/BryanMartin68/status/385916532573745152
BryanMartin68;2013-10-04 01:57;0;0;"The Ripple Effect: WITHEM - The Point Of You http:// ripplemusic.blogspot.com/2013/10/withem -point-of-you.html?spref=tw …";;;;"385916487426273280";https://twitter.com/BryanMartin68/status/385916487426273280
BryanMartin68;2013-10-04 01:56;0;0;"The Ripple Effect: A Ripple Conversation with Eddie Trunk - Eddie Tru... http:// ripplemusic.blogspot.com/2013/09/a-ripp le-conversation-with-eddie-trunk.html?spref=tw …";;;;"385916399756922880";https://twitter.com/BryanMartin68/status/385916399756922880
perfect__gifts;2013-10-04 01:50;0;0;"Si-Fi Thriller: Beneath a Darkening Moon ( Ripple Creek) by Keri Arthur: http:// bit.ly/TrMKNN";;;;"385914794332532736";https://twitter.com/perfect__gifts/status/385914794332532736
_The_Doctor____;2013-10-04 01:45;0;0;"Doctor Who Keep Calm I'm the Doctor Womens http://www. shortvale.com/1fyzp #Calm #Doctor #Junction #Keep #Ripple #Womens";;;#Calm #Doctor #Junction #Keep #Ripple #Womens;"385913465325752320";https://twitter.com/_The_Doctor____/status/385913465325752320
Aarrinn_;2013-10-04 01:43;0;0;"I think this will have such a big impact the ripple has begun and will travel miles further @creekcharacter Go Creek! #beavercreekpride";;@creekcharacter;#beavercreekpride;"385913010545782784";https://twitter.com/Aarrinn_/status/385913010545782784
11_bmiller;2013-10-04 01:42;0;0;"@molltiply fuuuuck downtown! Broad ripple !!";;@molltiply;;"385912794433847296";https://twitter.com/11_bmiller/status/385912794433847296
BarbaraStanny;2013-10-04 01:40;0;0;"I truly believe, if enough women step fully into their own power, we’d see a giant ripple effect on the global landscape. What do you...";;;;"385912266472030208";https://twitter.com/BarbaraStanny/status/385912266472030208
janhenrydesign;2013-10-04 01:40;0;0;"No time to promote your business on Facebook? Get a "Done for You" package from Ripple X Marketing: http:// fb.com/ripplexmarketi ng …";;;;"385912255507746816";https://twitter.com/janhenrydesign/status/385912255507746816
j_ripple;2013-10-04 01:39;0;1;"@samm_Boehm haha thank you! love you too";;@samm_Boehm;;"385912018483806208";https://twitter.com/j_ripple/status/385912018483806208
samm_Boehm;2013-10-04 01:39;0;0;"@j_ ripple is the best....EVER! Love youuuu";;@j_;;"385911945120849920";https://twitter.com/samm_Boehm/status/385911945120849920
KayleeTonks;2013-10-04 01:36;0;0;"S9E13 Ripple Effect #StargateSG1 #GetGlue http:// gtg.lu/18AsZOC";;;#StargateSG1 #GetGlue;"385911305078853632";https://twitter.com/KayleeTonks/status/385911305078853632
ShitRachelSays7;2013-10-04 01:36;1;0;"It was a ripple in the ocean of true love #ShitRachelSays";;;#ShitRachelSays;"385911287265648640";https://twitter.com/ShitRachelSays7/status/385911287265648640
CRowensboro;2013-10-04 01:34;0;0;"Never doubt the impact of a simple act of kindness....the ripple effect can be powerful.";;;;"385910872578596864";https://twitter.com/CRowensboro/status/385910872578596864
servantofchaos;2013-10-04 01:33;1;0;"POV: the digital disruption that Pandora represents is yet to ripple through the media networks here #digfestival";;;#digfestival;"385910507825528832";https://twitter.com/servantofchaos/status/385910507825528832
tiling_stores;2013-10-04 01:32;0;0;"Sample W60 Gold Ripple Glass Mosaic http://www. shortvale.com/1fyx7 #$699 #Glass #Gold #Mosaic #per #Ripple #SAMPLE #sqft #Tile #W60SAMPLE";;;# #Glass #Gold #Mosaic #per #Ripple #SAMPLE #sqft #Tile #W60SAMPLE;"385910289033879552";https://twitter.com/tiling_stores/status/385910289033879552
devillygirl;2013-10-04 01:32;0;0;"Reading The Ripple Effect, by J.A. Saare: I know I'm supposed to be all excited about this book...and I would be I... http:// bit.ly/18Unrj5";;;;"385910187728465921";https://twitter.com/devillygirl/status/385910187728465921
x_ThaWIFE;2013-10-04 01:31;0;0;"Goin to Ripple homecoming tomorrow";;;;"385909983180623873";https://twitter.com/x_ThaWIFE/status/385909983180623873
San_Lawrence;2013-10-04 01:30;0;0;"Zona Boy Z - (Young Ripple , Docseus Hd,) http:// rdo.to/MAFIA #nowplaying #listenlive";;;#nowplaying #listenlive;"385909703609704448";https://twitter.com/San_Lawrence/status/385909703609704448
TaiSwagyPMason;2013-10-04 01:29;0;0;"One good deed is a ripple effect.";;;;"385909484365049856";https://twitter.com/TaiSwagyPMason/status/385909484365049856
Lifestyles_Ph;2013-10-04 01:28;0;0;"Today- go out of your way to encourage someone! Be extra kind today! Start a RIPPLE effect in the world filled with love & kindness!...";;;;"385909324578828288";https://twitter.com/Lifestyles_Ph/status/385909324578828288
AustBitcoins;2013-10-04 01:28;0;0;"Seeing the Ripple Effect on Money http:// lnkd.in/bSZuUpF";;;;"385909184861974529";https://twitter.com/AustBitcoins/status/385909184861974529
allyson_ripple;2013-10-04 01:24;2;0;"But I still care about you.";;;;"385908297477668864";https://twitter.com/allyson_ripple/status/385908297477668864
Pkittay1;2013-10-04 01:24;0;1;"I'm upset that Dari ripple is closed. I really want a slushie.";;;;"385908180804308992";https://twitter.com/Pkittay1/status/385908180804308992
ALinsdau;2013-10-04 01:22;0;0;"Watched grapple ripple across the valley till it hit the house. Glad I wasn't out in this on Paintbrush Divide.";;;;"385907750158344192";https://twitter.com/ALinsdau/status/385907750158344192
WorldHeartBeats;2013-10-04 01:22;1;0;"Are you in on the ripple ? 1 million people are in in 3 months! Worth a look. http:// tinyurl.com/m4rcjtv";;;;"385907734266138624";https://twitter.com/WorldHeartBeats/status/385907734266138624username;date;retweets;favorites;text;geo;mentions;hashtags;id;permalink
indcountry;2013-10-22 01:57;0;0;"Ripple who take forever to respond!!!";;;;"392439416335388672";https://twitter.com/indcountry/status/392439416335388672
TobeyNause;2013-10-22 01:54;0;0;"Floating Ripple Vases by oodesign http:// fancy.to/dr5yt6 via @fancy";;@fancy;;"392438856488075265";https://twitter.com/TobeyNause/status/392438856488075265
AJAMThirdRail;2013-10-22 01:54;2;0;"What are some ripple effects of not dealing with mental health needs? Share your thoughts using #AJAMStream !";;;#AJAMStream;"392438843053703168";https://twitter.com/AJAMThirdRail/status/392438843053703168
Leeky_2x;2013-10-22 01:54;0;0;"@Sam_I_Am_Flash lmfaooooo thats what magnet he shoulda picked at ripple , all the big girls at ripple love frank";;@Sam_I_Am_Flash;;"392438784387608576";https://twitter.com/Leeky_2x/status/392438784387608576
chatelainedc;2013-10-22 01:52;0;0;"The total clusterf*** of traffic in DC tonight was cars turning into sea of pedestrians so maybe a car or 2 got through. Ripple effect chaos.";;;;"392438288508014592";https://twitter.com/chatelainedc/status/392438288508014592
jenniferdbarnes;2013-10-22 01:52;1;0;"Attending #SeaChange2013 this week? Pls join A. Ramsden & me as we present " Ripple Effect: Biomimicry & Nature's Genius" @AIBCconnected";;@AIBCconnected;#SeaChange2013;"392438266814681089";https://twitter.com/jenniferdbarnes/status/392438266814681089
JodieBCooper;2013-10-22 01:50;0;0;"A Blog Hop Place for Books: The Ripple Effect Romance Novella Series - Giveaway!! http:// bloghopforbooks.blogspot.com/2013/10/Ripple Effect.Blast.2013.Oct.html?spref=tw … #Romance #Novella";;;#Romance #Novella;"392437822138748928";https://twitter.com/JodieBCooper/status/392437822138748928
lovin_blog;2013-10-22 01:50;0;0;"Black forest choc ripple cake http://www. lovinblog.com/a/19949/black- forest-choc-ripple-cake.htm …";;;;"392437800030965760";https://twitter.com/lovin_blog/status/392437800030965760
LoveIsHereBrock;2013-10-22 01:49;0;0;"Story of the day: It doesn't take a lot to start a ripple of kindness that, over time, grows into a wave! http:// fb.me/PvrMySUO";;;;"392437519704281088";https://twitter.com/LoveIsHereBrock/status/392437519704281088
LindaSasta;2013-10-22 01:48;0;0;"@At_God and the surrounding land turns into immaculate gardens, representing the ripple on effect of education and a better future...";;@At_God;;"392437146759360512";https://twitter.com/LindaSasta/status/392437146759360512
digitalbio;2013-10-22 01:45;0;0;"@docfreeride @ericmjohnson seems there's a large ripple of collateral damage #Metoo";;@docfreeride @ericmjohnson;#Metoo;"392436606147112961";https://twitter.com/digitalbio/status/392436606147112961
AKearthquake;2013-10-22 01:42;0;1;""Watch the whole U.S. ripple ." Nice post from @TTremblingEarth featuring a great IRIS ground motion visualization: http:// bit.ly/18E0XmD";;@TTremblingEarth;;"392435666966966272";https://twitter.com/AKearthquake/status/392435666966966272
SiriusNews_com;2013-10-22 01:41;0;0;"Rippln's first hard product thru the ripple @JonathanBudd video http:// youtu.be/swWVJMHwqJk @BrianUndy LG @LukeGoss needs a watch Bond007";;@JonathanBudd @BrianUndy @LukeGoss;;"392435446200152064";https://twitter.com/SiriusNews_com/status/392435446200152064
freshxprincess;2013-10-22 01:36;0;0;"@LEGibbons yup, in south broad ripple !";;@LEGibbons;;"392434272616710145";https://twitter.com/freshxprincess/status/392434272616710145
SylviediGiusto;2013-10-22 01:35;1;0;"It's not only about you! The ripple effect of unprofessional behavior, blogged by @sylvie_digiusto http:// ow.ly/pFsPk #imageconsulting";;@sylvie_digiusto;#imageconsulting;"392434114806444032";https://twitter.com/SylviediGiusto/status/392434114806444032
e_evans15;2013-10-22 01:31;1;0;"@KhalifaBay just realized Alexis stale faced me when I said I was the of of ripple";;@KhalifaBay;;"392433070034276353";https://twitter.com/e_evans15/status/392433070034276353
ryanmckenz;2013-10-22 01:28;0;0;"Remember there's no such thing as a small act of kindness. Every act creates a ripple with no logical end -Adams";;;;"392432148822519809";https://twitter.com/ryanmckenz/status/392432148822519809
SeattleFriends;2013-10-22 01:26;0;1;"Thanks for favoriting our tweet @esringwald ! Just another example of the ripple effect of goodness.";;@esringwald;;"392431766184534017";https://twitter.com/SeattleFriends/status/392431766184534017
Sale_Wirth;2013-10-22 01:23;0;0;"Diamond Gotta see how the end of the ripple go #LIVE";;;#LIVE;"392430969858174977";https://twitter.com/Sale_Wirth/status/392430969858174977
AkeemLloyd06;2013-10-22 01:13;0;0;"2day we also welcomed 4new members who heard about what we've done & wish 2 do service as well #Ripple #Growth #Makebetterhappen";;;#Ripple #Growth #Makebetterhappen;"392428574567051264";https://twitter.com/AkeemLloyd06/status/392428574567051264
