username;date;retweets;favorites;text;geo;mentions;hashtags;id;permalink
steamworldsfair;2015-04-23 01:37;0;1;"There is no truth to the rumor that I plan to do a cover of " Ripple " wherein I substitute "Cheap Absinthe" for the titular beverage.";;;;"591022976725835776";https://twitter.com/steamworldsfair/status/591022976725835776
GIN_YAH;2015-04-23 01:34;0;0;"FUJIN Ripple";;;;"591022216852049921";https://twitter.com/GIN_YAH/status/591022216852049921
KissThisVix3n;2015-04-23 01:33;0;0;"@Kilroy's Broad Ripple https:// instagram.com/p/1y7jM4gJ-N/";;@Kilroy;;"591021993488703489";https://twitter.com/KissThisVix3n/status/591021993488703489
AmPakFdn;2015-04-23 01:30;0;0;"Artists’ work: The ripple effect http:// ow.ly/LYZa3";;;;"591021237779988480";https://twitter.com/AmPakFdn/status/591021237779988480
AKFCanada;2015-04-23 01:29;6;5;"Experiencing the ripple effects of #education . Come see it for yourself: http:// akfc.ca/together #AllForChange pic.twitter.com/iu9sYyip29";;;#education #AllForChange;"591021147547951104";https://twitter.com/AKFCanada/status/591021147547951104
brett_schneider;2015-04-23 01:24;0;0;"OVER 95% GRADUATE DEBT FREE FROM @BUTLERU ?! HOW MANY FUCKING SHOTS DID YOU HAVE IN BROAD RIPPLE ?";;@BUTLERU;;"591019780628414464";https://twitter.com/brett_schneider/status/591019780628414464
StonesThrowBrew;2015-04-23 01:20;0;0;"Bernoulli's shirts, Ripple Effect shirts, Two-Timing shirts and hoodies on sale tonight! $10 t-shirts and $24 hoodies pic.twitter.com/S2TvzzXGC4";;;;"591018832845672448";https://twitter.com/StonesThrowBrew/status/591018832845672448
tthcomic;2015-04-23 01:20;0;1;"@Markof_theBeast @dsharp524 hmmm will your pecs ripple so the words dance";;@Markof_theBeast @dsharp524;;"591018825128275968";https://twitter.com/tthcomic/status/591018825128275968
Dieter_DS;2015-04-23 01:20;0;1;"Consensus in the Ripple protocol explained by @JoelKatz : http:// bit.ly/1aoRZ1j #ripple #bitcoin";;@JoelKatz;#ripple #bitcoin;"591018653413351424";https://twitter.com/Dieter_DS/status/591018653413351424
RippleEffectMag;2015-04-23 01:19;0;0;"Enjoy This Archived Article From Ripple Effect ~ Virgin Eggs – A Chinese Delicacy Soake http://www. rippleeffectmag.com/virgin-eggs-a- chinese-delicacy-soaked-in-boys-urine/?utm_source=ReviveOldPost&utm_medium=social&utm_campaign=ReviveOldPost … pic.twitter.com/OGrjuE4nDV";;;;"591018566733803521";https://twitter.com/RippleEffectMag/status/591018566733803521
StarOfPlatinum;2015-04-23 01:19;0;0;"@TheRippleMaster "T-The Ripple ? I heard of that...of course, it couldn't be my grandfather that you taught.--";;@TheRippleMaster;;"591018436941217793";https://twitter.com/StarOfPlatinum/status/591018436941217793
Austin_strehle;2015-04-23 01:17;0;1;"Lol I feel bad for all the kids that have to do their drivers test in ripple with all that construction.";;;;"591018042554847233";https://twitter.com/Austin_strehle/status/591018042554847233
Kars_eng;2015-04-23 01:17;0;0;"I don't care about the ripple warriors from now on but you, that is DIFFERENT!";;;;"591017943669952512";https://twitter.com/Kars_eng/status/591017943669952512
BHHSCalifornia;2015-04-23 01:04;1;0;"Ripple Kids in Action - Information provided by: Riviera Orange County Help make Orange County a better place whil... http:// ow.ly/2XKzg1";;;;"591014730254397440";https://twitter.com/BHHSCalifornia/status/591014730254397440
josephjoestar_e;2015-04-23 01:00;0;0;"Check out my Ripple Bolas!";;;;"591013827644411906";https://twitter.com/josephjoestar_e/status/591013827644411906
ProjectHopeWW;2015-04-23 01:00;0;0;"The Ripple Effect: a situation in which one event causes a series of other events to happen.";;;;"591013626661605376";https://twitter.com/ProjectHopeWW/status/591013626661605376
DrJackMaGrawPhD;2015-04-23 00:57;0;0;"" @hoodjabi : Ripple effect https:// twitter.com/DrJackMaGrawPh D/status/591011940488630272 … "";;@hoodjabi;;"591012938078617600";https://twitter.com/DrJackMaGrawPhD/status/591012938078617600
hoodjabi;2015-04-23 00:56;0;0;"Ripple effect https:// twitter.com/DrJackMaGrawPh D/status/591011940488630272 …";;;;"591012634885025792";https://twitter.com/hoodjabi/status/591012634885025792
a_ripple;2015-04-23 00:51;0;0;"@rgay Yes please!";;@rgay;;"591011572027367424";https://twitter.com/a_ripple/status/591011572027367424
BoldProgressive;2015-04-23 00:50;4;3;"“When students graduate with loads of debt, the ripple effects are endless" @SenSchumer tells @HuffPostPol #DebtFreeCollege h/t @srlevine2";;@SenSchumer @HuffPostPol @srlevine2;#DebtFreeCollege;"591011110850928640";https://twitter.com/BoldProgressive/status/591011110850928640
prudham;2015-04-23 00:49;0;1;"Raspberry ripple ice cream with added magic stars is just amazing";;;;"591011023924162560";https://twitter.com/prudham/status/591011023924162560
tomseankelleher;2015-04-23 00:49;0;1;"@babushka99 Faisal Khan describes ideal SWIFT replacement http://www. quora.com/If-the-SWIFT-m oney-transfer-system-can-be-redesigned-today-how-would-you-do-it/answer/Faisal-Khan-1?srid=2caJ&share=1 … @Ripple #notbitcoin";;@babushka99 @Ripple;#notbitcoin;"591010880055185408";https://twitter.com/tomseankelleher/status/591010880055185408
woollyholic;2015-04-23 00:48;0;0;"@HappyElastic It started life as a giant granny, got ripped out and was then a ripple blanket but that bored me stupid so now it's a pile...";;@HappyElastic;;"591010736111017984";https://twitter.com/woollyholic/status/591010736111017984username;date;retweets;favorites;text;geo;mentions;hashtags;id;permalink
CyberPlayGround;2015-05-06 01:59;0;1;"FinCEN Fines Ripple Labs Inc. in First Civil Enforcement! http:// ow.ly/MzjP8";;;;"595739604289990659";https://twitter.com/CyberPlayGround/status/595739604289990659
MikeFairgrieve;2015-05-06 01:58;0;0;"@BBCJamesCook What a pathetic storm in a teacup. Not even a ripple . Still, it helps JM's victim narrative. Job done. Cheers Clerkin et al.";;@BBCJamesCook;;"595739402585952258";https://twitter.com/MikeFairgrieve/status/595739402585952258
BitAML;2015-05-06 01:57;1;0;"FinCEN Fines #Ripple Labs for #AML violations http://www. coindesk.com/fincen-fines-r ipple-labs-700000-bank-secrecy-act/ … Fines are just the beginning. The cost of remediation will be higher.";;;#Ripple #AML;"595739122607779840";https://twitter.com/BitAML/status/595739122607779840
bitcoinfirehose;2015-05-06 01:57;1;0;"Ripple Labs fined by FinCEN http:// ift.tt/1QklQrb #reddit #crypto";;;#reddit #crypto;"595739087459450880";https://twitter.com/bitcoinfirehose/status/595739087459450880
jeffcliff1;2015-05-06 01:57;0;2;"@ripple Guess there was no point to cuddling up to the US government, then was there?";;@ripple;;"595739009713831936";https://twitter.com/jeffcliff1/status/595739009713831936
tiffanymadison;2015-05-06 01:56;0;0;"FinCEN Fines Ripple Labs for Bank Secrecy Act Violations http://www. coindesk.com/fincen-fines-r ipple-labs-700000-bank-secrecy-act/ …";;;;"595738927534895104";https://twitter.com/tiffanymadison/status/595738927534895104
jeffcliff1;2015-05-06 01:56;0;2;"http://www. fincen.gov/news_room/nr/p df/20150505.pdf … so after all the betraying your @rippletrade customers with privacy invasion you *still* get fined? #ripple";;@rippletrade;#ripple;"595738779849195520";https://twitter.com/jeffcliff1/status/595738779849195520
masonic_tweets;2015-05-06 01:55;0;0;"List of #ripple violations according to #FinCen http://www. fincen.gov/news_room/nr/p df/Ripple_Facts.pdf …";;;#ripple #FinCen;"595738646793289728";https://twitter.com/masonic_tweets/status/595738646793289728
charlesfitz;2015-05-06 01:55;0;0;"@crashdev Ripple barely qualifies as virtual currency…";;@crashdev;;"595738638119542785";https://twitter.com/charlesfitz/status/595738638119542785
iang_fc;2015-05-06 01:54;3;1;"@marchochstein @lightcoin 8) this is mis-written, it can only apply to servers run by Ripple , not protocol itself. Also "analytical tools"";;@marchochstein @lightcoin;;"595738277946236928";https://twitter.com/iang_fc/status/595738277946236928
TheRealMage;2015-05-06 01:52;1;0;"Ripple Labs just got fined $700k by FinCen http://www. fincen.gov/news_room/nr/p df/20150505.pdf …";;;;"595737951520301057";https://twitter.com/TheRealMage/status/595737951520301057
newmichwill;2015-05-06 01:51;1;1;"@petertoddbtc @Ripple should look at what Pavel Kravchenko @Tembusuterminal implements. Elegant crypto AML/KYC for Ripple";;@petertoddbtc @Ripple @Tembusuterminal;;"595737622292594689";https://twitter.com/newmichwill/status/595737622292594689
Schmame;2015-05-06 01:50;0;0;"@lightcoin @PurbaBiz Ripple - N points of failure, not decentralized. 90+% of the asset is privately held. Yes decentralization is answer.";;@lightcoin @PurbaBiz;;"595737359905337345";https://twitter.com/Schmame/status/595737359905337345
Ele_Ent;2015-05-06 01:49;0;0;"Ripple Lab: Virtual currency startup slammed with $700,000 fine http:// dlvr.it/9hFZ3P";;;;"595737148210475008";https://twitter.com/Ele_Ent/status/595737148210475008
semseolin;2015-05-06 01:48;0;0;"Semseolin Blog, Ripple Labs Fined $700,000 by FinCEN, Will... http:// ift.tt/1GNG31x";;;;"595736953666084864";https://twitter.com/semseolin/status/595736953666084864
ripple_of_one;2015-05-06 01:47;1;1;"It's not too late to donate! Join our movement! https:// givelocal15.org/#npo/ripple-of -one … #GiveLocal15 #superawesome pic.twitter.com/1ZEHh5H9Ij";;;#npo #GiveLocal15 #superawesome;"595736721339392000";https://twitter.com/ripple_of_one/status/595736721339392000
bitcoinheadline;2015-05-06 01:47;0;0;"#Ripple Labs Fined #$700,000 by #FinCEN , Will Institute Transaction Monitoring Across Ripple Protocol: Earlier... http:// bit.ly/1cjvzjg";;;#Ripple # #FinCEN;"595736631614775296";https://twitter.com/bitcoinheadline/status/595736631614775296
Cryptotwins;2015-05-06 01:47;0;0;"FinCEN Fines Ripple Labs Inc. in First Civil Enforcement Action Against a Virtual Currency Exchanger via /r/Bitcoin …";;;;"595736516896382976";https://twitter.com/Cryptotwins/status/595736516896382976
ryanjtracy;2015-05-06 01:46;0;0;"2) FinCEN said Ripple processed $250k transaction for @rogerkver . who refused to fill out a KYC form. Details here... http://www. fincen.gov/news_room/nr/p df/Ripple_Facts.pdf …";;@rogerkver;;"595736270774599680";https://twitter.com/ryanjtracy/status/595736270774599680
lightcoin;2015-05-06 01:46;8;8;"The only way to eliminate the risk of central points of failure is to eliminate the central points of failure #bitcoin #p2p #ripple";;;#bitcoin #p2p #ripple;"595736256002314241";https://twitter.com/lightcoin/status/595736256002314241
ryanjtracy;2015-05-06 01:45;0;0;"@rogerkver Trying to reach you for story on FinCEN/ Ripple . Ryan.tracy@wsj.com";;@rogerkver @wsj;;"595736050624012289";https://twitter.com/ryanjtracy/status/595736050624012289
glcbitcoin;2015-05-06 01:45;0;0;"Ripple Labs Fined $700,000 by FinCEN, Will Institute Transaction Monitoring Across Ripple Protocol: Earlier to... http:// bit.ly/1cjvzjg";;;;"595736013122699264";https://twitter.com/glcbitcoin/status/595736013122699264
Beautyon_;2015-05-06 01:44;0;1;"If Ripple was based in Hong Kong, they could have sold the $250,000 of XRP that cost them a $700,000 fine without any consequences. DERP!";;;;"595735728056868864";https://twitter.com/Beautyon_/status/595735728056868864
FortuneBitXBit;2015-05-06 01:42;0;0;"shitco.in | FinCEN Fines Ripple Labs Inc. in First Civil Enforcement Action Against… http:// dlvr.it/9hFNq2 #bitXbit pic.twitter.com/HJ13AoKg5U";;;#bitXbit;"595735289542369280";https://twitter.com/FortuneBitXBit/status/595735289542369280
1PushNaija;2015-05-06 01:42;0;1;"Ripple Lab: Virtual currency startup slammed with $700,000 fine - http:// 1push.com.ng/ripple-lab-vir tual-currency-startup-slammed-with-700000-fine/ … pic.twitter.com/RRneH8dSCD";;;;"595735239059714049";https://twitter.com/1PushNaija/status/595735239059714049
mcneal_conchita;2015-05-06 01:40;0;0;"Allow the world to ripple into you with open arms and flow out with grace @davidji_com";;@davidji_com;;"595734863833133058";https://twitter.com/mcneal_conchita/status/595734863833133058
myikegami_bot;2015-05-06 01:40;0;0;"Ripple fined for acting as a money services business without registration http:// goo.gl/fb/f5Fjjg";;;;"595734835974504448";https://twitter.com/myikegami_bot/status/595734835974504448
Bitcoin_Spain;2015-05-06 01:40;1;0;"shitco.in | FinCEN Fines Ripple Labs Inc. in First Civil Enforcement Action Against a Virtual Currency Exchanger: http:// ift.tt/1GZhpk6 …";;;;"595734793326833664";https://twitter.com/Bitcoin_Spain/status/595734793326833664
yardcap;2015-05-06 01:39;1;0;"US Treasury slaps virtual currency startup Ripple Labs with $700K fine - VentureBeat http:// bit.ly/1cjHyx3 #стартап #startup";;;# #startup;"595734690016944128";https://twitter.com/yardcap/status/595734690016944128
CryptoJauregui;2015-05-06 01:39;0;0;"http:// ift.tt/1GZhpk6 shitco.in | FinCEN Fines Ripple Labs Inc. in First Civil Enforcement Action Against a Virtual Currency Exchanger #…";;;#;"595734672904200192";https://twitter.com/CryptoJauregui/status/595734672904200192username;date;retweets;favorites;text;geo;mentions;hashtags;id;permalink
connorhoward3;2015-05-15 01:58;0;4;"anyone going to broad ripple tonight? hit me up! I'm an uber driver";;;;"599000911407685632";https://twitter.com/connorhoward3/status/599000911407685632
BalmerBlackArt;2015-05-15 01:57;0;0;"Broad Ripple Art Fair returns this weekend - WISH-TV http:// dlvr.it/9q3lWp";;;;"599000642397442048";https://twitter.com/BalmerBlackArt/status/599000642397442048
paintsauce;2015-05-15 01:56;0;0;"Check out our $ 20 Open Studio nights at Sabbatical in Broad Ripple ! Paint whatever you like! http://www. paintsauce.com pic.twitter.com/hD5gc5Bm5y";;;;"599000252117553152";https://twitter.com/paintsauce/status/599000252117553152
x_VintageBesos;2015-05-15 01:51;0;0;"In broad ripple and the dude in Qdoba gave me a free drink";;;;"598999129067491328";https://twitter.com/x_VintageBesos/status/598999129067491328
WildBeaver;2015-05-15 01:50;0;0;"50-Cent Beers tonight!!!! Join us in Broad Ripple to grab a tray. #WildBeaver #BroadRipple";;;#WildBeaver #BroadRipple;"598998942810968065";https://twitter.com/WildBeaver/status/598998942810968065
TekstOversette;2015-05-15 01:44;0;0;"Dub_Fx - Everythinks A Ripple (Studio) - 5 - Fly With Me tekst og oversettelse av sang http:// tekst-oversettelse.com/sang/vis/47369 1/dub_fx-everythinks-a-ripple-studio/tekst-og-oversettelse-5-fly-with-me/ …";;;;"598997224857706496";https://twitter.com/TekstOversette/status/598997224857706496
Indy_Events;2015-05-15 01:32;0;0;"06/18 #Indy - Ripple Effect Live at the Moon Dog Tavern. http:// indyevents.com/view_event.php ?reminder_id=676508&ref=TWTR … #Indianapolis #Indiana";;;#Indy #Indianapolis #Indiana;"598994438770204673";https://twitter.com/Indy_Events/status/598994438770204673
bucksbuzztap;2015-05-15 01:31;0;0;"http:// brewhoop.com >> VIDEO: Milwaukee Bucks tout " Ripple Effects" of new downtown multi-purpose arena http:// buzztap.com/-Z6nzcu";;;;"598993957771587584";https://twitter.com/bucksbuzztap/status/598993957771587584
Cryptogeeks;2015-05-15 01:30;0;0;"Ripple Labs Fined $700,000 for Violating Bank Secrecy Act. Watch Full Video at http:// MoneyandTech.com - http:// cryptogeeks.com/ripple-labs-fi ned-700000-violating-bank-secrecy-act-watch-full-video-moneyandtechcom …";;;;"598993793426300928";https://twitter.com/Cryptogeeks/status/598993793426300928
michaelmaycomix;2015-05-15 01:30;1;0;"Dragonfly Ripple 's Weird West/Star Wars show: Carlin and I were part of the Nerd Lunch episode on the first S... http:// bit.ly/1d00P72";;;;"598993742951940096";https://twitter.com/michaelmaycomix/status/598993742951940096
CraftyGal65;2015-05-15 01:30;0;1;"Hey @mikesobel , you and Ripple are still making the rounds. This a post from a Mediterranean radio station. ( https://www. facebook.com/exploredogs/po sts/677312962300947 … )";;@mikesobel;;"598993704569810945";https://twitter.com/CraftyGal65/status/598993704569810945
noahzark93;2015-05-15 01:29;0;0;"Its official, I'm moving to Broad Ripple on Saturday.";;;;"598993666506555394";https://twitter.com/noahzark93/status/598993666506555394
Leyla_holistic;2015-05-15 01:29;0;1;"Who #looks outside, #dreams ; who looks inside, #awakes . #wakeupnow #bethechange #ripple";;;#looks #dreams #awakes #wakeupnow #bethechange #ripple;"598993527645851650";https://twitter.com/Leyla_holistic/status/598993527645851650
fmaddenNBA;2015-05-15 01:25;1;3;"VIDEO: Milwaukee Bucks tout " Ripple Effects" of new downtown multi-purpose arena http:// sbnation.com/e/8373354?utm_ campaign=brewhoop&utm_content=chorus&utm_medium=social&utm_source=twitter …";;;;"598992593997934592";https://twitter.com/fmaddenNBA/status/598992593997934592
dan_sinclair;2015-05-15 01:25;0;0;"VIDEO: Milwaukee Bucks tout " Ripple Effects" of new downtown multi-purpose arena http:// sbnation.com/e/8373354?utm_ campaign=dan_sinclair&utm_content=chorus&utm_medium=social&utm_source=twitter …";;;;"598992592823549952";https://twitter.com/dan_sinclair/status/598992592823549952
BusinesInspire;2015-05-15 01:22;1;1;"What we're doing here will send a giant ripple through the universe. ? Steve Jobs";;;;"598991749676015616";https://twitter.com/BusinesInspire/status/598991749676015616
JayessleeGlobal;2015-05-15 01:21;0;0;"My love is a silent. ever expanding ripple of wave. And you are the center of it.";;;;"598991568914120704";https://twitter.com/JayessleeGlobal/status/598991568914120704
CornerBarLargo;2015-05-15 01:20;0;0;"Ripple the weather dog (and Internet sensation) has been adopted http:// fb.me/2YYqBg0t4";;;;"598991244124106752";https://twitter.com/CornerBarLargo/status/598991244124106752
IndyECigs;2015-05-15 01:19;0;0;"Have you broke your SubTank Mini glass? @indyecigs Broad Ripple has replacement glass for you! Indy… https:// instagram.com/p/2rf-4bSwXc/";;@indyecigs;;"598991143020437504";https://twitter.com/IndyECigs/status/598991143020437504
ccnomad;2015-05-15 01:18;0;0;"@shkeeber Maybe Cheesecake with a dark red berry ripple & little chocolate skulls & crossbones throughout? @benandjerrys @Contwixt";;@shkeeber @benandjerrys @Contwixt;;"598990822869176321";https://twitter.com/ccnomad/status/598990822869176321
Kars_eng;2015-05-15 01:17;0;0;"It's the ripple you little piece of shit!!";;;;"598990565284286465";https://twitter.com/Kars_eng/status/598990565284286465
peterelvidge;2015-05-15 01:17;0;0;"Water Ripple Effect by pete4725 on DeviantArt http:// ift.tt/18LlLvY";;;;"598990470396682240";https://twitter.com/peterelvidge/status/598990470396682240
KimsCrochets;2015-05-15 01:13;0;1;"Bernat® Baby Coordinates™ Ripple Waves Crochet Blanket FREE Pattern... Beautiful blue! http:// pinterest.com/pin/4554969497 88950535/ …";;;;"598989595867533312";https://twitter.com/KimsCrochets/status/598989595867533312
defamethegame;2015-05-15 01:13;0;1;"@Aschick41 @rustymk2 between this dude and the bridge crowd its post apocalyptic bike rides in broad ripple !";;@Aschick41 @rustymk2;;"598989469975388162";https://twitter.com/defamethegame/status/598989469975388162
MarkDCady;2015-05-15 01:13;0;1;"@jmcnabb I am not. In the ripple sampling beer";;@jmcnabb;;"598989445325574144";https://twitter.com/MarkDCady/status/598989445325574144
jeannieonmaui;2015-05-15 01:12;0;0;"I'm so excited! #anniversary #dinner at #Ripple in #ClevelandPark They made a Happy Anniversary… https:// instagram.com/p/2rioUsMo5b/";;;#anniversary #dinner #Ripple #ClevelandPark;"598989230245830657";https://twitter.com/jeannieonmaui/status/598989230245830657
Elchaninovstar;2015-05-15 01:11;1;2;"Workout series #2 - Shared on Ripple @rippleMeThis pic.twitter.com/OhEkyQqYYs";;@rippleMeThis;#2;"598988996002324480";https://twitter.com/Elchaninovstar/status/598988996002324480
aussiefintech;2015-05-15 01:10;0;0;"Ripple Labs Targets Asia amid ‘Strategic Shift’ in Regional Trade from USD to RMB http:// ow.ly/MSmQS #fintech";;;#fintech;"598988737507414017";https://twitter.com/aussiefintech/status/598988737507414017
aussiecw;2015-05-15 01:10;0;1;"Ripple Labs Targets Asia amid ‘Strategic Shift’ in Regional Trade from USD to RMB http:// ow.ly/2YypN0 #fintech";;;#fintech;"598988736194551808";https://twitter.com/aussiecw/status/598988736194551808
NuanceEnt;2015-05-15 01:10;1;1;"Poor #custserv has a ripple effect w/ 78% likely to take action after a bad #custexp . Are you prepared? @WakeFieldStats";;@WakeFieldStats;#custserv #custexp;"598988731476004864";https://twitter.com/NuanceEnt/status/598988731476004864username;date;retweets;favorites;text;geo;mentions;hashtags;id;permalink
ClassierDeals;2015-05-18 01:55;0;0;"a.n.a A New Approach Gold Ripple Stretch Bracelet 7.25" NWT$18 http:// ebay.to/1bBzhEw pic.twitter.com/SWw0lpKNxh";;;;"600087178769666048";https://twitter.com/ClassierDeals/status/600087178769666048
ClassierDeals;2015-05-18 01:55;0;0;"✰ A.N.A. Modern Trend Silver Water Ripple Statement Bracelet Stretch http:// ebay.to/1ElxxpU pic.twitter.com/8T9476kck5";;;;"600087166207729664";https://twitter.com/ClassierDeals/status/600087166207729664
ClassierDeals;2015-05-18 01:55;0;0;"∂♢ A.N.A. Modern Trend Silver Water Ripple Statement Bracelet Stretch http:// ebay.to/1ElxxpU pic.twitter.com/4ypCVLk5Xl";;;;"600087164857159680";https://twitter.com/ClassierDeals/status/600087164857159680
Carmilla5;2015-05-18 01:51;0;0;"Heaven in the mouth! Raspberry Ripple Buckwheat Porridge http://www. mynewroots.org/site/2014/07/r aspberry-ripple-buckwheat-porridge/ … via @mynewroots";;@mynewroots;;"600086288595693568";https://twitter.com/Carmilla5/status/600086288595693568
Emma_babydoll1;2015-05-18 01:51;0;0;"I've just ate an galaxy ripple & a Boston cream donut in bed & it's nearly one am. I am not ashamed of this";;;;"600086271738912770";https://twitter.com/Emma_babydoll1/status/600086271738912770
CeleritasPrime;2015-05-18 01:50;0;0;"I was at a comedy show last night in Broad Ripple with a corn trader..... https:// twitter.com/thedrewpowell/ status/600082864441462784 …";;;;"600086121796743168";https://twitter.com/CeleritasPrime/status/600086121796743168
ghhsbucs;2015-05-18 01:48;4;4;"Acts Of Kindness: 'A Ripple Creates A Wave'.Inspiring Our Community. Wacky Field Day raised $340 for Random Acts pic.twitter.com/la8E9yMTC7";;;;"600085582077960192";https://twitter.com/ghhsbucs/status/600085582077960192
christinenj;2015-05-18 01:48;0;0;"And the ripple effects of my soon-to-be ex-BIL's actions are starting. The cheating bastard needs to DIAF.";;;;"600085469137924096";https://twitter.com/christinenj/status/600085469137924096
krysnclark;2015-05-18 01:45;1;1;"@princesswasabii it's like a ripple effect";;@princesswasabii;;"600084795717193729";https://twitter.com/krysnclark/status/600084795717193729
PerryMaryBond;2015-05-18 01:38;0;1;"@tjHOTTUNA okay I got it....First: Rob Lowe.....then: Hannah & her horse(prolly your preference) but now: TJ Reba & Ripple ....call direct TV";;@tjHOTTUNA;;"600082961581608960";https://twitter.com/PerryMaryBond/status/600082961581608960
josephjoestar_e;2015-05-18 01:32;0;0;"Check out my Ripple Bolas!";;;;"600081418572722177";https://twitter.com/josephjoestar_e/status/600081418572722177
JustineBot;2015-05-18 01:30;0;1;"Ripple @makerfaire #Makerfaire2015 pic.twitter.com/xk3r2qyPTo";;@makerfaire;#Makerfaire2015;"600081002040438784";https://twitter.com/JustineBot/status/600081002040438784
peterelvidge;2015-05-18 01:29;0;0;"pete4725: peterelvidge: Water Ripple Effect by pete4725 on DeviantArt http:// ift.tt/18LlLvY";;;;"600080756950626304";https://twitter.com/peterelvidge/status/600080756950626304
PERSEVERANCENET;2015-05-18 01:28;0;0;"peterelvidge: Water Ripple Effect by pete4725 on DeviantArt http:// ift.tt/18LlLvY";;;;"600080441958375424";https://twitter.com/PERSEVERANCENET/status/600080441958375424
LeadershipTwt;2015-05-18 01:28;0;0;"What we're doing here will send a giant ripple through the universe. ? Steve Jobs";;;;"600080366779641856";https://twitter.com/LeadershipTwt/status/600080366779641856
GraaacieBush;2015-05-18 01:25;0;0;"hey does someone in group three for ripple effect wanna hmu???";;;;"600079823780782081";https://twitter.com/GraaacieBush/status/600079823780782081
PCCHHMassageSpa;2015-05-18 01:25;0;0;"Massage definitely creates a ripple effect! http:// fb.me/7PfLRtFSj";;;;"600079807691493376";https://twitter.com/PCCHHMassageSpa/status/600079807691493376
6ohTurner;2015-05-18 01:25;0;2;"DQ is decent & all but coulda went with some Dairy Ripple";;;;"600079770928455680";https://twitter.com/6ohTurner/status/600079770928455680
IndianapolisCP;2015-05-18 01:23;0;0;"Group of teens rescue injured boaters stuck in Broad Ripple Dam: The Indianapolis Fire Department assisted three… http:// indianapolis.cityandpress.com/node/9595910";;;;"600079171100942336";https://twitter.com/IndianapolisCP/status/600079171100942336
KonoDIOGa;2015-05-18 01:22;0;0;"@AchtungJoJo I imagine so. I wish you luck, all the same. A Stand user well versed in the Ripple is an exceptional warrior. How well do -";;@AchtungJoJo;;"600079057410084864";https://twitter.com/KonoDIOGa/status/600079057410084864
freebookshub;2015-05-18 01:21;1;0;"Righting a Wrong (A Ripple Effect Romance Novella) – By Rachael Anderson (Dollar Book) http:// dlvr.it/9s2Rp4 pic.twitter.com/VQvnQCqrHY";;;;"600078808402657280";https://twitter.com/freebookshub/status/600078808402657280
KonoDIOGa;2015-05-18 01:20;0;0;"@AchtungJoJo Are there that many Ripple masters left in the world? [he asked, curious]";;@AchtungJoJo;;"600078520379834369";https://twitter.com/KonoDIOGa/status/600078520379834369
emm_shields;2015-05-18 01:20;0;0;"I just wanna live in broad ripple !!!";;;;"600078496208007168";https://twitter.com/emm_shields/status/600078496208007168
KonoDIOGa;2015-05-18 01:17;0;0;"@AchtungJoJo Ah, so. Joseph is teaching you the Ripple ?";;@AchtungJoJo;;"600077705418149889";https://twitter.com/KonoDIOGa/status/600077705418149889
