username;date;retweets;favorites;text;geo;mentions;hashtags;id;permalink
Caroline_NPG;2016-03-12 23:32;0;0;"10 Husband points awarded for a ripple mcflurrry delivery! https://www. instagram.com/p/BC3q6TJoMTq/";;;;"708782681664913408";https://twitter.com/Caroline_NPG/status/708782681664913408
PlanetOfTheApex;2016-03-12 23:30;0;2;"when you reach the bottom of the tub of raspberry ripple https:// twitter.com/SamsungRacing/ status/708769606698209280 …";;;;"708782355549294592";https://twitter.com/PlanetOfTheApex/status/708782355549294592
MTC_Marinecoin;2016-03-12 23:30;0;0;"#Bitcoin#Litecoin or #ripple or #Dogecoin diversify to #Marinecoin #MTC today for %1000 profits Thomasena Bayhonan";;;#Bitcoin #Litecoin #ripple #Dogecoin #Marinecoin #MTC;"708782127744208897";https://twitter.com/MTC_Marinecoin/status/708782127744208897username;date;retweets;favorites;text;geo;mentions;hashtags;id;permalink
shewn007;2016-05-12 01:59;0;0;"What concerns me is not occupy nass @bukolasaraki please I can afford d new price but not the ripple effect. Edakun sir #FuelSubsidy";;@bukolasaraki;#FuelSubsidy;"730547961462194176";https://twitter.com/shewn007/status/730547961462194176
droolindog;2016-05-12 01:59;0;0;"Local news startup Ripple apologizes for taking other people’s news https:// pcproactive.wordpress.com/2016/05/11/loc al-news-startup-ripple-apologizes-for-taking-other-peoples-news/ … pic.twitter.com/oGNvNsbDeJ";;;;"730547930818588672";https://twitter.com/droolindog/status/730547930818588672
LisaLambson;2016-05-12 01:58;0;0;"Red Butterfly Ripple Counted Cross Stitch Printable Pattern, Instant Download PDF http:// fb.me/5pvUOoJZA";;;;"730547681827774465";https://twitter.com/LisaLambson/status/730547681827774465
NaveenAlexandra;2016-05-12 01:57;0;0;"Local news startup Ripple apologizes for taking other people’s news https:// pcproactive.wordpress.com/2016/05/11/loc al-news-startup-ripple-apologizes-for-taking-other-peoples-news/ … pic.twitter.com/idBK6d3dsU";;;;"730547339866320897";https://twitter.com/NaveenAlexandra/status/730547339866320897
FreedomsPhoenix;2016-05-12 01:57;0;0;"Overpopulation? Economic Ripple Effect From Fewer Babies: "Market Is Not Going to Grow" https://www. FreedomsPhoenix.com/News/196781-20 16-05-11-overpopulation-economic-ripple-effect-from-fewer-babies-market-is-not.htm?EdNo=001&From=RSS&utm_source=dlvr.it&utm_medium=twitter …";;;;"730547311059685376";https://twitter.com/FreedomsPhoenix/status/730547311059685376
coriandesign;2016-05-12 01:56;1;1;"Thomas Winkelmann: "You start having an impact on 1 person & that has a ripple effect & you can have an effect on millions." #CorianBlurred";;;#CorianBlurred;"730547216058880000";https://twitter.com/coriandesign/status/730547216058880000
nwsayer;2016-05-12 01:54;0;0;"... And it's, like HUGE, OCEAN WAVE looking ripple . #ick";;;#ick;"730546579451437056";https://twitter.com/nwsayer/status/730546579451437056
_MusicDrugs_;2016-05-12 01:53;17;38;"Anoice - Ripple . https:// soundcloud.com/pouyan-ohadi/a noice-ripple …";;;;"730546496630726656";https://twitter.com/_MusicDrugs_/status/730546496630726656
nwsayer;2016-05-12 01:53;0;0;"300 mV P-P of ripple @1A. #Rejected #TryAgain pic.twitter.com/DYnhu0op9B";;@1A;#Rejected #TryAgain;"730546282708656128";https://twitter.com/nwsayer/status/730546282708656128
MusingsOnLove;2016-05-12 01:50;1;1;"We're participating in the 2016 Spring Broad Ripple Art Walk this Friday from 5-9p! We hope you can stop by and... http:// fb.me/76LNViX0V";;;;"730545685955809280";https://twitter.com/MusingsOnLove/status/730545685955809280
DMikesum;2016-05-12 01:49;0;0;"It will not cause a ripple to the Trumpists. I'm not sure it should. Not like it's lying to dead American's families.";;;;"730545498587865088";https://twitter.com/DMikesum/status/730545498587865088
MusingsOnLove;2016-05-12 01:48;0;0;"We're participating in the 2016 Spring Broad Ripple Art Walk this Friday from 5-9p! We hope you… https://www. instagram.com/p/BFSTYlVThzp/";;;;"730545257386004481";https://twitter.com/MusingsOnLove/status/730545257386004481
Razorlobo;2016-05-12 01:43;0;1;"Local news startup Ripple apologizes for taking other people's news http://www. recode.net/2016/5/11/1165 9274/ripple-gothamist-dnainfo-apology?utm_campaign=www.recode.net&utm_content=entry&utm_medium=social&utm_source=twitter … via @Recode";;@Recode;;"730543905335181312";https://twitter.com/Razorlobo/status/730543905335181312
CantBeatThePats;2016-05-12 01:41;0;1;"Broad ripple stays lit";;;;"730543335815950336";https://twitter.com/CantBeatThePats/status/730543335815950336
JoeLipari;2016-05-12 01:39;0;0;"he can cause the time ripple that erases Zack Snyder.";;;;"730542763826155520";https://twitter.com/JoeLipari/status/730542763826155520
kickdown2010;2016-05-12 01:38;0;0;"Local news startup Ripple apologizes for taking other people's news http:// goo.gl/fb/Ke7R6M";;;;"730542706318020608";https://twitter.com/kickdown2010/status/730542706318020608
ripple_yogawear;2016-05-12 01:35;0;0;"For your best yoga leggings click here > http:// bit.ly/24PETEp get ready for your new addiction #yogawear #yoga #yogapositions #YogaLovers";;;#yogawear #yoga #yogapositions #YogaLovers;"730541849417551872";https://twitter.com/ripple_yogawear/status/730541849417551872
LunaBlueCreates;2016-05-12 01:34;0;0;"http:// rallywithripple.com/profiles/gary- sinise-foundation/139;text=Gary … Sinise Foundation on Rally with Ripple ;via=rallywithripple";;;;"730541689559986176";https://twitter.com/LunaBlueCreates/status/730541689559986176
Trim_App;2016-05-12 01:30;0;0;"Local news startup Ripple apologizes for taking other people's news - http:// bit.ly/1rGUHaS";;;;"730540593131225088";https://twitter.com/Trim_App/status/730540593131225088
itechaddict;2016-05-12 01:30;0;0;"Local news startup Ripple apologizes for taking other people’s news http:// ift.tt/1TbICDM pic.twitter.com/RxEgWcOvw0";;;;"730540567671783425";https://twitter.com/itechaddict/status/730540567671783425
Indy_Events;2016-05-12 01:30;0;0;"#Indy 05/12 - Indianapolis Art Center Open in Broad Ripple . http:// indyevents.com/view_event.php ?reminder_id=783454&ref=TWTR …";;;#Indy;"730540524470304768";https://twitter.com/Indy_Events/status/730540524470304768
sid_tam;2016-05-12 01:29;0;1;"Local news startup Ripple apologizes for taking other people's news - http:// ift.tt/24PuGrH";;;;"730540445130993664";https://twitter.com/sid_tam/status/730540445130993664
chcosts;2016-05-12 01:25;0;1;"Unbelievable. Local news startup Ripple apologizes for taking other people's news - Recode http:// ow.ly/ZmR93007yav";;;;"730539380918657026";https://twitter.com/chcosts/status/730539380918657026
readonlythese;2016-05-12 01:25;0;0;"Local news startup Ripple apologizes for taking other people's news - http:// ift.tt/24PuGrH";;;;"730539377848365056";https://twitter.com/readonlythese/status/730539377848365056
BeezBot;2016-05-12 01:25;1;0;"Local news startup Ripple apologizes for taking other people's news via @pkafka #Tech http:// buff.ly/1TQTNlo pic.twitter.com/RPbBPlIum7";;@pkafka;#Tech;"730539376225206272";https://twitter.com/BeezBot/status/730539376225206272
Ripple_px;2016-05-12 01:24;0;0;"3594ノーツｗｗｗｗｗｗｗｗｗｗｗ";;;;"730538984850350080";https://twitter.com/Ripple_px/status/730538984850350080
jpbutler;2016-05-12 01:20;0;0;"Local news startup Ripple apologizes for taking other people's news http://www. recode.net/2016/5/11/1165 9274/ripple-gothamist-dnainfo-apology?utm_campaign=www.recode.net&utm_content=entry&utm_medium=social&utm_source=twitter … via @Recode";;@Recode;;"730538031007072257";https://twitter.com/jpbutler/status/730538031007072257
NiemanLabFuego;2016-05-12 01:20;1;0;"Local news startup Ripple apologizes for taking other people's news http:// nie.mn/1T9c3te via @pkafka";;@pkafka;;"730537986572488705";https://twitter.com/NiemanLabFuego/status/730537986572488705
doferdrick;2016-05-12 01:19;0;1;"Been replaying #fable for #xbox . A ripple in the water means pressing the down d-pad action button. https://www. instagram.com/p/BFSP_rxQdVV/";;;#fable #xbox;"730537805248643072";https://twitter.com/doferdrick/status/730537805248643072
mathewi;2016-05-12 01:17;3;3;"Local news startup Ripple apologizes for taking other people's news http://www. recode.net/2016/5/11/1165 9274/ripple-gothamist-dnainfo-apology?utm_campaign=www.recode.net&utm_content=entry&utm_medium=social&utm_source=twitter … via @Recode";;@Recode;;"730537456869777410";https://twitter.com/mathewi/status/730537456869777410username;date;retweets;favorites;text;geo;mentions;hashtags;id;permalink
BrentTerhune;2016-06-15 01:55;2;7;"Stoop Kid: I'm never leaving my stoop Arnold: Brent Terhune is at Crackers in Broad Ripple June 30th-July 2nd pic.twitter.com/pc4CH4KBJF";;;;"742868190557011969";https://twitter.com/BrentTerhune/status/742868190557011969
Daaanyelll;2016-06-15 01:54;0;2;"How have I not been to Dari ripple yet";;;;"742867889544302593";https://twitter.com/Daaanyelll/status/742867889544302593
AltcoinsBank;2016-06-15 01:50;0;0;"Re: Waves vs Ripple http:// cur.lv/zlpmj #bitcoin #blockchain";;;#bitcoin #blockchain;"742866867191091200";https://twitter.com/AltcoinsBank/status/742866867191091200
cbengage;2016-06-15 01:48;0;0;"Shaylan shares how important it is to be thoughtful in the choice of waste company and how we can make a ripple ... http:// fb.me/1iVWb7cVT";;;;"742866280923942912";https://twitter.com/cbengage/status/742866280923942912
AmanLee_;2016-06-15 01:46;2;1;"How i was jelous of that wind that always ripple through your shirt everyday, but not me";;;;"742865848679825408";https://twitter.com/AmanLee_/status/742865848679825408
SkaiBlueMedia;2016-06-15 01:44;2;7;"When 2 disrupters come 2gether 2 make a change, join the ripple effect of #GenderEquality ! #StateOfWomen pic.twitter.com/OtApwx07vt";;;#GenderEquality #StateOfWomen;"742865421628547072";https://twitter.com/SkaiBlueMedia/status/742865421628547072
PPIndKentucky;2016-06-15 01:44;0;0;""SCOTUS' upcoming decision will have major ripple effects not only in TX, but across the country" http:// bit.ly/260j0zy";;;;"742865213582508032";https://twitter.com/PPIndKentucky/status/742865213582508032
hopehendersonnn;2016-06-15 01:43;0;0;"Come out to Joseph's and Robert's performance tonight at LandSharks at 10 in broad ripple ! @RJE323";;@RJE323;;"742865096943112192";https://twitter.com/hopehendersonnn/status/742865096943112192
Ripple;2016-06-15 01:43;0;1;"Our current company handle is @Ripple . Thank you!";;@Ripple;;"742864989661192192";https://twitter.com/Ripple/status/742864989661192192
ripple_yogawear;2016-06-15 01:42;0;0;"natural fabrics yoga tops, now at 20%off > http:// bit.ly/1RZNrzh #yoga #ripplecollection #yogi #naturalfabric pic.twitter.com/PxXUljNKkE";;;#yoga #ripplecollection #yogi #naturalfabric;"742864929129168897";https://twitter.com/ripple_yogawear/status/742864929129168897
Reggie477;2016-06-15 01:41;0;0;"Dinner at Monon Food Company in Broad Ripple . pic.twitter.com/zszvRLR1Mh";;;;"742864632788987904";https://twitter.com/Reggie477/status/742864632788987904
FoxTicious;2016-06-15 01:39;0;2;"Life goals: start a positive ripple . To have a child, donate more time than money, advise respect and common sense. pic.twitter.com/WQndW1UGjs";;;;"742864109574586369";https://twitter.com/FoxTicious/status/742864109574586369
JosephineLeah2;2016-06-15 01:37;0;0;"The truthful vested interest ripple is with respect to so that go off?: hqlwLGdQr";;;;"742863477467807744";https://twitter.com/JosephineLeah2/status/742863477467807744
LaBelliere;2016-06-15 01:36;0;0;"New York Regulators Grant Second BitLicense to Ripple http:// bit.ly/1tsuJJl via @CoinDesk@";;@CoinDesk @;;"742863271389188096";https://twitter.com/LaBelliere/status/742863271389188096
Banyan_Global;2016-06-15 01:34;3;13;"Educating a girl has a generational impact, a ripple effect.- @SophiaBush #StateOfWomen @USWomen2016 @WhiteHouse";;@SophiaBush @USWomen2016 @WhiteHouse;#StateOfWomen;"742862926936215552";https://twitter.com/Banyan_Global/status/742862926936215552
JanShewan;2016-06-15 01:34;0;0;"small daily actions make for beautiful ripple effects";;;;"742862810049220608";https://twitter.com/JanShewan/status/742862810049220608
AlyStewartA;2016-06-15 01:33;0;1;"Just saw a guy in Broad Ripple riding his bike barefoot, playing the guitar, and singing.";;;;"742862590527823873";https://twitter.com/AlyStewartA/status/742862590527823873
ben_ripple;2016-06-15 01:32;0;0;"except nat's environ policies will make us mordor and not so much the shire";;;;"742862250248048640";https://twitter.com/ben_ripple/status/742862250248048640
Jasmine_Rico;2016-06-15 01:31;0;0;"broad ripple !";;;;"742861980994797569";https://twitter.com/Jasmine_Rico/status/742861980994797569
martinjudy46;2016-06-15 01:31;0;0;"Ripple Effect: Trump Pushes 11 States Toward The Democrats http:// townhall.com/tipsheet/mattv espa/2016/05/07/ripple-effect-trumps-pushes-11-states-to-the-democrats-n2159255 …";;;;"742861970286616578";https://twitter.com/martinjudy46/status/742861970286616578
bweiss14;2016-06-15 01:30;0;1;"Downtown or Ripple ?";;;;"742861749246791680";https://twitter.com/bweiss14/status/742861749246791680
LisaLisa_en;2016-06-15 01:29;0;0;"So you can at least stand on water with the ripple ...";;;;"742861522582437888";https://twitter.com/LisaLisa_en/status/742861522582437888
Mitsu_0818;2016-06-15 01:29;0;0;"Japan Explores the Future of #Blockchain | Ripple https:// ripple.com/insights/japan -trade-ministry-explores-future-blockchain/ …";;;#Blockchain;"742861503892586496";https://twitter.com/Mitsu_0818/status/742861503892586496
srr728;2016-06-15 01:28;0;2;"You'd buy a freezer just for them !";;;;"742861293099618304";https://twitter.com/srr728/status/742861293099618304
Manner_C;2016-06-15 01:27;0;0;"@allisoncfisher @niceytreat @EatHereIndy @YelpIndy @Broad_ Ripple @VisitIndy id try it";;@allisoncfisher @niceytreat @EatHereIndy @YelpIndy @Broad_ @VisitIndy;;"742861087456952320";https://twitter.com/Manner_C/status/742861087456952320
alt_bit_coins;2016-06-15 01:25;0;0;"Temenos t24 core #banking solution integrates #ripple technology #bitcoin #crypto http:// j.mp/1Pm6ZQz pic.twitter.com/anriePaIy2";;;#banking #ripple #bitcoin #crypto;"742860539257356288";https://twitter.com/alt_bit_coins/status/742860539257356288
lisagiven;2016-06-15 01:21;0;1;"A cold and foggy morning in #Bathurst for day one of @RIPPLE _CSU research mtgs #brrr pic.twitter.com/isDxHd8ZAI";;@RIPPLE;#Bathurst #brrr;"742859641705484289";https://twitter.com/lisagiven/status/742859641705484289
CryptoMoms;2016-06-15 01:21;1;2;"9 months & #NewYork Regulators have issued only 2 #BitLicenses http:// bit.ly/1tsuJJl via @CoinDesk #Ripple #tech pic.twitter.com/Fm22v41IRB";;@CoinDesk;#NewYork #BitLicenses #Ripple #tech;"742859546431889409";https://twitter.com/CryptoMoms/status/742859546431889409
L0nd0ner88;2016-06-15 01:21;0;1;"looking forward to meeting Barbara and buying some more raspberry ripple";;;;"742859477649625088";https://twitter.com/L0nd0ner88/status/742859477649625088
BenBrowder_Net;2016-06-15 01:20;1;5;"Ben Browder Stargate SG1 - Ripple Effect https:// tmblr.co/ZI5bsx27wGJy5 #benbrowder #stargate";;;#benbrowder #stargate;"742859191476465664";https://twitter.com/BenBrowder_Net/status/742859191476465664username;date;retweets;favorites;text;geo;mentions;hashtags;id;permalink
bitcoinagile;2016-07-13 01:57;2;0;"TrustSetAuth Will Soon Be Available Ripple #Bitcoin #Blockchain #amendments #gateways #rcl https:// ripple.com/dev-blog/trust setauth-will-soon-available … pic.twitter.com/VPjeLV3MYa";;;#Bitcoin #Blockchain #amendments #gateways #rcl;"753015454076198913";https://twitter.com/bitcoinagile/status/753015454076198913
stepheraye;2016-07-13 01:54;0;2;"My mother has a habit of eating ruffled chips and crunching EVERY single ripple off individually...";;;;"753014587084120064";https://twitter.com/stepheraye/status/753014587084120064
admireablelwt;2016-07-13 01:52;0;0;"Raspberry ripple https:// twitter.com/lgbtwinks/stat us/748282878992101376 …";;;;"753014274675662848";https://twitter.com/admireablelwt/status/753014274675662848
dragons1lk;2016-07-13 01:49;0;0;"Clouds ripple across the sky. #sun #sea #sky #clouds https://www. instagram.com/p/BHx8t_MD5NV/";;;#sun #sea #sky #clouds;"753013413849300992";https://twitter.com/dragons1lk/status/753013413849300992
kevinhinklejoyo;2016-07-13 01:47;0;0;"feel the #vibration as it #ripples you are that ripple #BEtheripple ♡... http:// tsu.co/Kevinhinkle/13 0468595 … pic.twitter.com/IuYVv5h8lL";;;#vibration #ripples #BEtheripple;"753012986902634497";https://twitter.com/kevinhinklejoyo/status/753012986902634497
psalvitti;2016-07-13 01:46;3;1;"Catch up on #blockchain tech with our summer reading list! https:// ripple.com/?p=12301 via @ripple";;@ripple;#blockchain;"753012729590456322";https://twitter.com/psalvitti/status/753012729590456322
RippleFoods;2016-07-13 01:46;0;0;"Ripple is made with yellow split peas. And do try the Chocolate; we trust you'll think its delicious and it's our best seller :)";;;;"753012698288361477";https://twitter.com/RippleFoods/status/753012698288361477
Emolga;2016-07-13 01:44;0;0;"THE RIPPLE pic.twitter.com/xBm2M8JkGG";;;;"753012132636135424";https://twitter.com/Emolga/status/753012132636135424
psalvitti;2016-07-13 01:44;0;1;"Citi Research: how distributed ledgers have “the potential to create radically new models.” https:// ripple.com/?p=12490 via @ripple #blockchain";;@ripple;#blockchain;"753012124574740480";https://twitter.com/psalvitti/status/753012124574740480
fudge__ripple;2016-07-13 01:44;0;0;"I need a friend with a sailboat in my lineup";;;;"753012094967156736";https://twitter.com/fudge__ripple/status/753012094967156736
josephjoestar_b;2016-07-13 01:40;1;0;"I'm all oiled up and ready to ripple !";;;;"753011137352835072";https://twitter.com/josephjoestar_b/status/753011137352835072
ripple_yogawear;2016-07-13 01:35;0;2;"soft bras are my favourite, take a look at our cotton stone wash version> http:// bit.ly/20Vu9hq … #ripplecollection #yoga #yogi #yogacloth";;;#ripplecollection #yoga #yogi #yogacloth;"753009959357517824";https://twitter.com/ripple_yogawear/status/753009959357517824
yungvolatile;2016-07-13 01:33;0;0;"Oh haha you know that guy? You heard of him? My ripple in space-time managed to hit something?";;;;"753009314684506112";https://twitter.com/yungvolatile/status/753009314684506112
nickyb_zero3;2016-07-13 01:32;0;0;"Double scoop ice cream rum and raisin mix with chocolate ripple";;;;"753009070261604352";https://twitter.com/nickyb_zero3/status/753009070261604352
OnMySpaceship;2016-07-13 01:19;0;0;"http:// ift.tt/29vHsBT Rachel Pally Harlow Maxi Wrap Dress - Sz S 'Tandoori Ripple ' Print NWT";;;;"753006005475217412";https://twitter.com/OnMySpaceship/status/753006005475217412
Nemesis_Arete;2016-07-13 01:19;0;0;"In honoring urself;U honor others.In loving urself;U can love others.Throw the rock in the pond & watch ur love ripple across the universe.";;;;"753005830249648128";https://twitter.com/Nemesis_Arete/status/753005830249648128
kristovatlas;2016-07-13 01:11;0;0;"for? I was just thinking this paper on ripple is awesome, but now cannot find if I tweeted at much. :)";;;;"753003759425429504";https://twitter.com/kristovatlas/status/753003759425429504
CeIestialUnity;2016-07-13 01:10;0;0;""..they find the simple sight of a ripple of water or rising of the sun to be more exquisite than any beautiful antique or lovely painting."";;;;"753003518072655872";https://twitter.com/CeIestialUnity/status/753003518072655872
fudge__ripple;2016-07-13 01:09;0;1;"I still slightly refuse to believe old people penetrate";;;;"753003436614963200";https://twitter.com/fudge__ripple/status/753003436614963200
_KMart20;2016-07-13 01:08;0;1;"FUDGE RIPPLE ICE CREAM";;;;"753003031449305088";https://twitter.com/_KMart20/status/753003031449305088
vegan;2016-07-13 01:06;14;26;"Have you tried Ripple yet? GQ has, and they really liked it! http://www. gq.com/story/what-is- pea-milk … @RippleFoods @GQMagazine";;@RippleFoods @GQMagazine;;"753002609494065152";https://twitter.com/vegan/status/753002609494065152
PromotCommotion;2016-07-13 01:01;0;0;"Everyone's favorite Downtown Store~~ Ripple is also participating in our Sept 30 event with Fashionista Roanoke... http:// fb.me/2DB6DFO09";;;;"753001250862477312";https://twitter.com/PromotCommotion/status/753001250862477312
coinstats;2016-07-13 01:00;0;0;"Ripple - XRP Price: $0.00637561 Change in 1h: +0.06% Market cap: $225352132.0 Ranking: 3 #Ripple #XRP";;;#Ripple #XRP;"753001039838580736";https://twitter.com/coinstats/status/753001039838580736
ripple_yogawear;2016-07-13 00:51;0;1;"That's how I've started my morning how did you start yours? #rippecollection #yoga #yogaclothes #yogi #yogaeverywhere pic.twitter.com/w8Zh7mzMFF";;;#rippecollection #yoga #yogaclothes #yogi #yogaeverywhere;"752998958071418880";https://twitter.com/ripple_yogawear/status/752998958071418880
Coach_Rudy;2016-07-13 00:50;0;4;"I love my work with teachers! I am inspired by their dedication and by the ripple effects of this work! pic.twitter.com/YuOsnAEJpg";;;;"752998695600287745";https://twitter.com/Coach_Rudy/status/752998695600287745
GEMODUBZ;2016-07-13 00:46;0;1;"---> woosta - ripple (herzeloyde phlip) by @HerzeloydeMUSIC https:// soundcloud.com/herzeloyde/woo sta-ripple-herzeloyde-phlip … on #SoundCloud";;@HerzeloydeMUSIC;#SoundCloud;"752997495387619328";https://twitter.com/GEMODUBZ/status/752997495387619328
JACKIEDEKOTO;2016-07-13 00:45;0;0;"Check out CROCHET baby blanket afghan wrap chevron ripple handmade VANNA charcoal grey #Handmade http:// cgi.ebay.com/ws/eBayISAPI.d ll?ViewItem&item=252459221821&roken=cUgayN&soutkn=8CvdW1 … via @eBay";;@eBay;#Handmade;"752997354261864448";https://twitter.com/JACKIEDEKOTO/status/752997354261864448
NeilSWilliamson;2016-07-13 00:44;0;0;"Former Vermonter Kelly Miles a new #Albemarle resident applauds screening but is concerned about ripple effect of development on trees";;;#Albemarle;"752997202256101376";https://twitter.com/NeilSWilliamson/status/752997202256101376
JACKIEDEKOTO;2016-07-13 00:44;0;0;"Check out CROCHET baby blanket afghan wrap chevron ripple handmade VANNA WHITE multi BOHO http:// cgi.ebay.com/ws/eBayISAPI.d ll?ViewItem&item=252459221060&roken=cUgayN&soutkn=o7lsLR … via @eBay";;@eBay;;"752997098073780225";https://twitter.com/JACKIEDEKOTO/status/752997098073780225
JACKIEDEKOTO;2016-07-13 00:43;0;0;"CROCHET baby blanket afghan wrap chevron ripple handmade VANNA BOHO multi color #Handmade http:// pinterest.com/pin/3648620072 94637499/ …";;;#Handmade;"752996876794945538";https://twitter.com/JACKIEDEKOTO/status/752996876794945538username;date;retweets;favorites;text;geo;mentions;hashtags;id;permalink
NahImOkThanks;2016-09-01 01:52;0;3;"I ate a ripple ... that counts as a meal, right?";;;;"771133528067145728";https://twitter.com/NahImOkThanks/status/771133528067145728
crimson_fyre72;2016-09-01 01:42;0;0;"Anne caused more of a ripple than Virginia who disappeared in the later half of the 16th century I figured Anne was more notable to mention.";;;;"771131117416001536";https://twitter.com/crimson_fyre72/status/771131117416001536
AlexisMarivoet;2016-09-01 01:39;0;0;"Hey @SanInnoventures , @bancosantander :PoC with @Ripple =>are you able to settle funds in accounts ON THE SAME DAY ? Thanks guys!";;@SanInnoventures @bancosantander @Ripple;;"771130337581670400";https://twitter.com/AlexisMarivoet/status/771130337581670400
MaxParthas;2016-09-01 01:38;0;0;"8PM EST US Today on New Abolitionists Radio August 31st 2016 • Tonight we'll be examining the ripple effects... http:// fb.me/2rBq38RwC";;;;"771130058446471168";https://twitter.com/MaxParthas/status/771130058446471168
MTC_Marinecoin;2016-09-01 01:30;0;0;"#Bitcoin#Litecoin or #ripple or #Dogecoin diversify to #Marinecoin #MTC today for %1000 profits Jerold Barre";;;#Bitcoin #Litecoin #ripple #Dogecoin #Marinecoin #MTC;"771127940532805632";https://twitter.com/MTC_Marinecoin/status/771127940532805632
QueenInsidious;2016-09-01 01:28;0;0;"-- been so long since I felt the full effects of powerful magic flood my veins and ripple through my body like a tsunami --";;;;"771127662572081152";https://twitter.com/QueenInsidious/status/771127662572081152
philinsuffolk;2016-09-01 01:26;0;0;"There won't be 92 FT professional clubs in English football in 15 years. The ripple effect of money will hit L2 and maybe L1. @JNorthcroft";;@JNorthcroft;;"771127080960593920";https://twitter.com/philinsuffolk/status/771127080960593920
baumansbrain;2016-09-01 01:26;0;2;"All y'all: if i knew the way, i would take you home. Feeling #unabashedlydead #ripple pic.twitter.com/j12nw6lsXG";;;#unabashedlydead #ripple;"771126948147892224";https://twitter.com/baumansbrain/status/771126948147892224
susansmith96;2016-09-01 01:24;0;0;"I just checked in at Rams Ripple with #mPLUSPlaces Download today! http:// bit.ly/gomplaces";;;#mPLUSPlaces;"771126570064842752";https://twitter.com/susansmith96/status/771126570064842752
OfficialLondonR;2016-09-01 01:22;0;0;"I feel like when you change one thing, it cause a ripple affect… https://www. instagram.com/p/BJypWccB8cAQ cpoeIGnVEpGicaIkzlFUxJ8b2I0/ …";;;;"771125963430121473";https://twitter.com/OfficialLondonR/status/771125963430121473
JayessleeGlobal;2016-09-01 01:20;0;0;"My love is a silent. ever expanding ripple of wave. And you are the center of it.";;;;"771125585074466816";https://twitter.com/JayessleeGlobal/status/771125585074466816
SWTFootballClub;2016-09-01 01:18;0;0;"Disappointed with the judges marks for my dive in the technical area tonight. Low marks for technique and I never made a ripple ? Enuffsaid";;;;"771125068231536640";https://twitter.com/SWTFootballClub/status/771125068231536640
NYSpacesmag;2016-09-01 01:15;0;1;"Looking for a cool light? Look no further, Ripple from AVENUE ROAD is a surefire stunner! http:// fb.me/UgeHK417";;;;"771124291723145217";https://twitter.com/NYSpacesmag/status/771124291723145217
