username;date;retweets;favorites;text;geo;mentions;hashtags;id;permalink
nicolebozell;2014-07-16 01:34;0;1;"@stephgwood He's discovered the secret and it's spread to the Pizza Hut kid on Broad Ripple Ave.";;@stephgwood;;"489191272477769728";https://twitter.com/nicolebozell/status/489191272477769728
PatWilsonDJ;2014-07-16 01:33;0;1;"@remiarnaxx lool yes mother thank you ripple";;@remiarnaxx;;"489191121181245440";https://twitter.com/PatWilsonDJ/status/489191121181245440
kenzie_woodard3;2014-07-16 01:33;2;3;"so happy @MEifert made the trip to Indy for a spontaneous broad ripple night. @justinepredan @paigefollett @molly_sid @abbybullerdick4";;@MEifert @justinepredan @paigefollett @molly_sid @abbybullerdick4;;"489191035499581441";https://twitter.com/kenzie_woodard3/status/489191035499581441
4qaby;2014-07-16 01:30;0;0;"Assembla: Interested in cryptocurrencies? Get started with 1000 free Ripple XRP http://www. 4qa.by/news/assembla- interested-in-cryptocurrencies-get-started-with-1000-free-ripple-xrp/ …";;;;"489190321277112320";https://twitter.com/4qaby/status/489190321277112320
RegardingBTC;2014-07-16 01:30;0;0;"#Bitcoin Prices: Btc-e:$614.98; Bitfinex:$621.13; Bitstamp:$622.95; Ripple :$624.74415256; http:// BTC.re";;;#Bitcoin;"489190178423332864";https://twitter.com/RegardingBTC/status/489190178423332864
LisaLisa_en;2014-07-16 01:26;0;0;"So you can at least stand on water with the ripple ...";;;;"489189398357872640";https://twitter.com/LisaLisa_en/status/489189398357872640
RobiandRoISF;2014-07-16 01:25;2;2;"" @SocialGoodEarth Even one small drop can make a ripple in the water & one small decision can affect yr life in the simplest way. #ISFamily";;@SocialGoodEarth;#ISFamily;"489189137552252929";https://twitter.com/RobiandRoISF/status/489189137552252929
appplug;2014-07-16 01:24;0;0;"Top rated iPad App: Flux Family Secrets - The Ripple Effect HD (FULL) 4.5/5★ - Big Fish Games, Inc #games ... http:// c69.co/5346614";;;#games;"489188800954773505";https://twitter.com/appplug/status/489188800954773505
shermanburdette;2014-07-16 01:24;1;4;"Me as Homecoming King at Broad Ripple High School in 1976...wow! http:// fb.me/2atWt4JoH";;;;"489188786400952320";https://twitter.com/shermanburdette/status/489188786400952320
AuthorBookBuzz;2014-07-16 01:20;0;0;"#amreading - This can change your life #ChildAbuse : The Ripple Effect http:// amzn.to/1sMGNyQ @ParentingNick #family #IARTG #ASMSG";;@ParentingNick;#amreading #ChildAbuse #family #IARTG #ASMSG;"489187707667898368";https://twitter.com/AuthorBookBuzz/status/489187707667898368
stpiranscross;2014-07-16 01:19;0;1;"@ppbrady12 @LawnmowerThomas Anything to cause a ripple in the #leftie world of holidays and strikes is a good thing.";;@ppbrady12 @LawnmowerThomas;#leftie;"489187518219558912";https://twitter.com/stpiranscross/status/489187518219558912
peaceblonde;2014-07-16 01:18;0;0;"RIP Mark ♫ Ripple – Grateful Dead http:// spoti.fi/NJ43ey #NowPlaying";;;#NowPlaying;"489187155822927873";https://twitter.com/peaceblonde/status/489187155822927873
cristylugo;2014-07-16 01:17;0;0;"When in Indiana #beer @Kilroy's Broad Ripple http:// instagram.com/p/qfWXxbBAl6/";;@Kilroy;#beer;"489187031948726272";https://twitter.com/cristylugo/status/489187031948726272
RegardingBTC;2014-07-16 01:15;0;0;"#Bitcoin Prices: Btc-e:$614.48; Bitfinex:$621.13; Bitstamp:$622.16; Ripple :$624.74415256; http:// BTC.re";;;#Bitcoin;"489186404044656641";https://twitter.com/RegardingBTC/status/489186404044656641
walker8701;2014-07-16 01:12;0;0;"Caramel fudge, real diary ice cream ripple";;;;"489185692422246400";https://twitter.com/walker8701/status/489185692422246400
JayessleeGlobal;2014-07-16 01:11;0;0;"My love is a silent. ever expanding ripple of wave. And you are the center of it.";;;;"489185473642766336";https://twitter.com/JayessleeGlobal/status/489185473642766336
ThespianArtist;2014-07-16 01:06;0;0;"RT Pretty cool library for ink ripple effects on any web UI element! #materialdesign http:// fplus.me/p/8dSz/10000000 pic.twitter.com/JXW1o23h3t";;;#materialdesign;"489184250462093313";https://twitter.com/ThespianArtist/status/489184250462093313
CSSTeam_at;2014-07-16 01:03;0;0;"Recreating the Touch Ripple Effect as Seen on Google Design http:// webdesign.tutsplus.com/tutorials/recr eating-the-touch-ripple-effect-as-seen-on-google-design--cms-21655 …";;;;"489183413837250560";https://twitter.com/CSSTeam_at/status/489183413837250560username;date;retweets;favorites;text;geo;mentions;hashtags;id;permalink
KkPIngle;2014-07-27 01:58;0;0;"The ripple effect- it does a lot damage";;;;"493183710557405184";https://twitter.com/KkPIngle/status/493183710557405184
jamesgreid;2014-07-27 01:56;0;0;"Derry: Drumahoe's flags ripple from every lamp post http:// dlvr.it/6RGvmd";;;;"493183177830047744";https://twitter.com/jamesgreid/status/493183177830047744
ninews;2014-07-27 01:56;0;1;"Guardian: Derry: Drumahoe's flags ripple from every lamp post | Susan McKay: A Protestant friend says the loya... http:// bit.ly/1q18rpM";;;;"493183074801156096";https://twitter.com/ninews/status/493183074801156096
encaf1;2014-07-27 01:55;0;0;"Also thinking: did we really almost forget Tesla in history, or are we witnessing the most recent example of a backward ripple in time?";;;;"493182878130638848";https://twitter.com/encaf1/status/493182878130638848
NorthernIrelnd;2014-07-27 01:50;0;0;"Derry: Drumahoe’s flags ripple from every lamp post | Susan McKay http:// dlvr.it/6RGrp5 #tweetni";;;#tweetni;"493181648142217217";https://twitter.com/NorthernIrelnd/status/493181648142217217
jamesgreid;2014-07-27 01:49;0;0;"Derry: Drumahoe's flags ripple from every lamp post http:// dlvr.it/6RGqRP";;;;"493181251734343680";https://twitter.com/jamesgreid/status/493181251734343680
BreakingNews_nl;2014-07-27 01:49;0;0;"Derry: Drumahoe's flags ripple from every lamp post: A Protestant friend says the loyalist flags will... http:// dlvr.it/6RGqJC #guardian";;;#guardian;"493181240363581441";https://twitter.com/BreakingNews_nl/status/493181240363581441
melmpem;2014-07-27 01:48;0;0;"Derry: Drumahoe's flags ripple from every lamp post: A Protestant friend says the loyalist flags will dwindle ... http:// bit.ly/1lHZNcY";;;;"493180989481304064";https://twitter.com/melmpem/status/493180989481304064
RegardingBTC;2014-07-27 01:46;0;0;"#Bitcoin Prices: Btc-e:$590.002; Bitfinex:$594.38; Bitstamp:$595.9; Ripple :$598.54337746; http:// BTC.re";;;#Bitcoin;"493180486358155264";https://twitter.com/RegardingBTC/status/493180486358155264
1AndOnlyEmilyJ;2014-07-27 01:41;0;0;"A pebble in the water makes a ripple effect every action in this world will bear a consequence <3 http:// spoti.fi/KiBnXi #NowPlaying";;;#NowPlaying;"493179447315419137";https://twitter.com/1AndOnlyEmilyJ/status/493179447315419137
EduardoRoo;2014-07-27 01:39;0;0;"Derry: Drumahoe's flags ripple from every lamp post: A Protestant friend says the loyalist flags will dwindle ... http:// bit.ly/1lHXYNq";;;;"493178751354548225";https://twitter.com/EduardoRoo/status/493178751354548225
FDSWorldwide;2014-07-27 01:38;0;0;"Derry: Drumahoe's flags ripple from every lamp post | Susan McKay: A Protestant friend says the loyalist flags... http:// bit.ly/1q13X2A";;;;"493178548832583680";https://twitter.com/FDSWorldwide/status/493178548832583680
TheLiamMurphy;2014-07-27 01:38;0;0;"Derry: Drumahoe's flags ripple from every lamp post | Susan McKay: A Protestant friend says the loyalist flags... http:// bit.ly/1q13X2A";;;;"493178547188428800";https://twitter.com/TheLiamMurphy/status/493178547188428800
RueTheWhorl;2014-07-27 01:36;0;0;"#OldDutch #ripple #chips with #dip . This is #summer";;;#OldDutch #ripple #chips #dip #summer;"493178141007814657";https://twitter.com/RueTheWhorl/status/493178141007814657
Pink_Pebbles;2014-07-27 01:36;0;0;"Khaleesi Cuff Bracelet $339.00 Embrace the bold and brave spirit of a warrior princess with this ripple -textured... http:// fb.me/20BJWs7Cg";;;;"493178008409481216";https://twitter.com/Pink_Pebbles/status/493178008409481216
trakasis;2014-07-27 01:35;0;0;"It's so bland. No splashes when you hop in, not even a ripple , maybe.";;;;"493177883402461184";https://twitter.com/trakasis/status/493177883402461184
newsfromreading;2014-07-27 01:34;0;0;"Derry: Drumahoe’s flags ripple from every lamp post http:// wp.me/p3DWqF-4lA";;;;"493177684919201792";https://twitter.com/newsfromreading/status/493177684919201792
sr_newsuk;2014-07-27 01:33;0;0;"Derry: Drumahoe's flags ripple from every lamp post http:// ift.tt/1xhFjgR | Guardian";;;;"493177352424529920";https://twitter.com/sr_newsuk/status/493177352424529920
abigailwarner;2014-07-27 01:32;0;2;"One tweet about Muncie and I get several tweets/ texts. I'm going to broad ripple leave me alone/ buy me a shot if you see me.";;;;"493177146030821376";https://twitter.com/abigailwarner/status/493177146030821376
VForAdi;2014-07-27 01:31;0;0;"Derry: Drumahoe's flags ripple from every lamp post: A Protestant friend says the loyalist flags will dwindle ... http:// bit.ly/1lHXYNq";;;;"493176804933255169";https://twitter.com/VForAdi/status/493176804933255169
RegardingBTC;2014-07-27 01:31;0;0;"#Bitcoin Prices: Btc-e:$590.002; Bitfinex:$593.97; Bitstamp:$596.05; Ripple :$598.54337746; http:// BTC.re";;;#Bitcoin;"493176710138171393";https://twitter.com/RegardingBTC/status/493176710138171393
jayseezgotgrit;2014-07-27 01:21;0;1;"In a field of pure #silence introducing your#intention creates a small #ripple #meditation#Universe";;;#silence #intention #ripple #meditation #Universe;"493174234881863680";https://twitter.com/jayseezgotgrit/status/493174234881863680
GWorldComments;2014-07-27 01:19;0;0;"Derry: Drumahoe's flags ripple from every lamp post | Susan McKay http:// ift.tt/1otvf3A";;;;"493173730630463488";https://twitter.com/GWorldComments/status/493173730630463488
RegardingBTC;2014-07-27 01:16;0;0;"#Bitcoin Prices: Btc-e:$590.001; Bitfinex:$593.78; Bitstamp:$596.23; Ripple :$598.54337746; http:// BTC.re";;;#Bitcoin;"493172936124403712";https://twitter.com/RegardingBTC/status/493172936124403712
AlfieKaka;2014-07-27 01:14;0;1;"Grey warbler trills ripple through the valley @zealandia";;@zealandia;;"493172457704919041";https://twitter.com/AlfieKaka/status/493172457704919041
BlockTrade_io;2014-07-27 01:13;0;2;"Would you trade on an exchange with protections against #HFT and other #MarketManipulation schemes? #StopHFT #altcoins #ripple #bitcoin";;;#HFT #MarketManipulation #StopHFT #altcoins #ripple #bitcoin;"493172260774371329";https://twitter.com/BlockTrade_io/status/493172260774371329
SolutionsAcu;2014-07-27 01:12;0;0;"Trainers and dietitians have long observedyhe positive ripple effect of healthy choices. Once you start physical... http:// fb.me/2GyG2z4KL";;;;"493171940476338176";https://twitter.com/SolutionsAcu/status/493171940476338176
kmcguire14;2014-07-27 01:11;0;5;"Put in a full shift last night in broad ripple . End of the funeral to 3 am. Shoutout to the companions who were with me";;;;"493171731456999424";https://twitter.com/kmcguire14/status/493171731456999424
cathsecnews;2014-07-27 01:11;0;0;"#Catholic #Christian Derry: Drumahoe's flags ripple from every lamp post - The Guardian: Derr... http:// bit.ly/1lHVHlc #News #Headlines";;;#Catholic #Christian #News #Headlines;"493171656940986368";https://twitter.com/cathsecnews/status/493171656940986368
meaganne84;2014-07-27 01:03;0;0;"@NHaza27 lots of ppl love Naked Tchopstix in broad ripple . i think it's fine, but a bit too Americanized for me...";;@NHaza27;;"493169652101435393";https://twitter.com/meaganne84/status/493169652101435393username;date;retweets;favorites;text;geo;mentions;hashtags;id;permalink
tmarchitelli;2014-08-06 01:57;0;1;"Started from the bottom now were here lol #CNTower #1465feetdown #Ripple 'sScared http:// instagram.com/p/rVfqycN_HB/";;;#CNTower #1465feetdown #Ripple;"496807300943052800";https://twitter.com/tmarchitelli/status/496807300943052800
clingmusic;2014-08-06 01:54;1;1;"Posted a new song: " Ripple On The Ocean VIP RMX" http://www. reverbnation.com/q/4xvnzr #music";;;#music;"496806598702923776";https://twitter.com/clingmusic/status/496806598702923776
rtv6;2014-08-06 01:45;0;1;"Broad Ripple residents discuss parking changes to reduce congestion, crime, @ChanceWalserRTV reports -- http:// bit.ly/X05uOt";;@ChanceWalserRTV;;"496804117700829186";https://twitter.com/rtv6/status/496804117700829186
clingmusic;2014-08-06 01:42;0;0;"@Arielredhunter https://www. yousendit.com/download/ZUcwb GtNTkxrWStHR3NUQw … Hi this is the link to download Ripple On The Ocean RMX - hope you like it :)";;@Arielredhunter;;"496803346729414657";https://twitter.com/clingmusic/status/496803346729414657
nipanidisoty;2014-08-06 01:40;0;0;"Each time we act to improve the life of another person we send forth a ripple of hope in what appears to be a hopeless society.";;;;"496802894113701888";https://twitter.com/nipanidisoty/status/496802894113701888
PantophilePanic;2014-08-06 01:34;0;0;"Your safe haven for all things fucked. Previous post: Ripple Small http://www. pantophilepanic.com/ripple-small/";;;;"496801535779549184";https://twitter.com/PantophilePanic/status/496801535779549184
TennesseeRecord;2014-08-06 01:34;0;0;"#VW success will ripple through Tennessee - We are incredibly fortunate to live in a... http:// j.mp/1nVpVae #BobCorker #LamarAlexander";;;#VW #BobCorker #LamarAlexander;"496801401545056256";https://twitter.com/TennesseeRecord/status/496801401545056256
RegardingBTC;2014-08-06 01:31;0;0;"#Bitcoin Prices: Btc-e:$577.9; Bitfinex:$582.79; Kraken:$584.24767; Ripple :$586; http:// BTC.re";;;#Bitcoin;"496800603608449025";https://twitter.com/RegardingBTC/status/496800603608449025
conley_001;2014-08-06 01:29;0;0;"Anyone can make a ripple effect .It only takes courage and determination to be Fit and Alive at 105 . Never Give up pic.twitter.com/zq3vLL1yYm";;;;"496800230088531968";https://twitter.com/conley_001/status/496800230088531968
hingminari;2014-08-06 01:26;0;0;"i just spent 36k on this dragon but I'VE WANTED A RIPPLE /CURRENT WILDCLAW I DESERVE NICE DRAGONS http:// flightrising.com/main.php?p=lai r&id=51248&tab=dragon&did=5427153 …";;;;"496799494470897664";https://twitter.com/hingminari/status/496799494470897664
Olalakanmi;2014-08-06 01:25;0;0;"Each time we act to improve the life of another person, we send forth a ripple of hope in what appears to be a hopeless society.";;;;"496799109601574912";https://twitter.com/Olalakanmi/status/496799109601574912
tvr1313_ripple;2014-08-06 01:22;0;0;"Hurray! I have finished "Helping Neighbors" task in Big Business HD for iPad! http:// tinyurl.com/kys2emy #gameinsight #ipad #ipadgames";;;#gameinsight #ipad #ipadgames;"496798343541313537";https://twitter.com/tvr1313_ripple/status/496798343541313537
AnthoLimit;2014-08-06 01:20;0;0;"Photo: a-hiatus-blog: fat-animals: A pigeon that is fat. That pigeon looks like it would ripple if you... http:// tmblr.co/Zt5rVv1NTqGmi";;;;"496797837234286594";https://twitter.com/AnthoLimit/status/496797837234286594
indystar;2014-08-06 01:15;6;12;"Ezra's could be Broad Ripple 's healthiest restaurant, serving raw, vegan dishes. http:// indy.st/1s8ko1X pic.twitter.com/aeS8QaYLQd";;;;"496796607803703298";https://twitter.com/indystar/status/496796607803703298
oilsofjoy;2014-08-06 01:13;0;0;"I am that ripple , and if your aren't part of my ripple , come join me. http://www. oilsofjoy.us http:// fb.me/2tGuoDujO";;;;"496796217284624385";https://twitter.com/oilsofjoy/status/496796217284624385
avianmark;2014-08-06 01:04;2;1;"Ripple - 300 days - 105,000 users Stellar - 7 days - 123,000 users";;;;"496793882328592385";https://twitter.com/avianmark/status/496793882328592385
666Beastism999;2014-08-06 01:04;0;0;"( #Christ ) The Angel says See Agent a "Once she sees a ripple around this she's gonna start connecting dots and eventually remember..."";;;#Christ;"496793854415491074";https://twitter.com/666Beastism999/status/496793854415491074
CultBranding;2014-08-06 01:01;1;0;"A single act does make a difference; it creates a ripple effect that can be felt many miles and people away. #Inspiration";;;#Inspiration;"496793173159854080";https://twitter.com/CultBranding/status/496793173159854080
SalinaF5;2014-08-06 00:58;0;0;"Peak-to-Peak Output Current Ripple Analysis in Multiphase and Multilevel Inverters (Springer Theses):... http:// amzn.to/1njJmID";;;;"496792305227948032";https://twitter.com/SalinaF5/status/496792305227948032
IndianapolisCP;2014-08-06 00:57;0;0;"Broad Ripple residents discuss parking changes: Police have been focusing on Broad Ripple in recent weeks after... http:// dlvr.it/6X3fBm";;;;"496792039791415298";https://twitter.com/IndianapolisCP/status/496792039791415298
JohnnyHotTakes;2014-08-06 00:56;0;0;"Don't know what ripple is, but I'm gonna assume that was a #hottake .";;;#hottake;"496791950142361600";https://twitter.com/JohnnyHotTakes/status/496791950142361600
roadnowpa;2014-08-06 00:55;0;0;"Congestion, avg 10mph on I-80 EB between PA-478 and Canoe Ripple Rd - http:// roadnow.com/us/pa/events/c ongestion-avg-10mph-on-i-80-eb-between-pa-478-and-canoe-ripple-rd-9231419064942 …";;;;"496791707430551552";https://twitter.com/roadnowpa/status/496791707430551552
josephjoestar_e;2014-08-06 00:55;0;0;"Check out my Ripple Bolas!";;;;"496791651097247744";https://twitter.com/josephjoestar_e/status/496791651097247744
roadnowi80;2014-08-06 00:55;0;0;"PA,Congestion, avg 10mph on I-80 EB between PA-478 and Canoe Ripple Rd - http:// roadnow.com/i80/events/pa- congestion-avg-10mph-on-i-80-eb-between-pa-478-and-canoe-ripple-rd-9231419064942 …";;;;"496791636450344962";https://twitter.com/roadnowi80/status/496791636450344962
RippexNet;2014-08-06 00:54;0;1;"@Ripple mentioned: http://www. bankinnovation.net/2014/08/8-unde r-the-radar-fintech-startups-you-should-know/ …";;@Ripple;;"496791506444103680";https://twitter.com/RippexNet/status/496791506444103680
wsculley;2014-08-06 00:54;8;3;"Praise from @BankInnovation for @Ripple , @ohadsamet / @trueaccord , @davedesharnais / @Traxpay http://www. bankinnovation.net/2014/08/8-unde r-the-radar-fintech-startups-you-should-know/ …";;@BankInnovation @Ripple @ohadsamet @trueaccord @davedesharnais @Traxpay;;"496791463024291840";https://twitter.com/wsculley/status/496791463024291840
gryeipfrut;2014-08-06 00:53;0;0;"@fishnbacon WITH STRAWBERRY AND RASPBERRY RIPPLE ICE CREAM";;@fishnbacon;;"496791128385916929";https://twitter.com/gryeipfrut/status/496791128385916929
Instant_Ripple;2014-08-06 00:48;1;1;"Added registration feature to the login screen. #update";;;#update;"496789985404538880";https://twitter.com/Instant_Ripple/status/496789985404538880
MohandasFrankl;2014-08-06 00:47;0;0;"Ezra's could be Broad Ripple 's healthiest restaurant http:// indy.st/1s8ko1X @indystar #CFS #MECFS";;@indystar;#CFS #MECFS;"496789502287814656";https://twitter.com/MohandasFrankl/status/496789502287814656
LindaJoy;2014-08-06 00:45;0;1;""I’ve found that stepping into my own feminine power gives others permission to do the same – it’s a beautiful ripple effect." @jodi_chapman";;@jodi_chapman;;"496789095495245824";https://twitter.com/LindaJoy/status/496789095495245824username;date;retweets;favorites;text;geo;mentions;hashtags;id;permalink
Simplyy_Divinee;2014-08-29 01:58;0;0;"I seen a cute couple at Dari ripple and it reminded me of how we used to be";;;;"505142291883782145";https://twitter.com/Simplyy_Divinee/status/505142291883782145
PatriotsInsider;2014-08-29 01:55;1;0;"ARTICLE: Dr. Roto Video: Trade Ripple Effects: Dr. Roto explains the ripple effects of New England Patriots tr... http:// foxs.pt/1qHb9DZ";;;;"505141587303604224";https://twitter.com/PatriotsInsider/status/505141587303604224
Autismwithwine;2014-08-29 01:51;7;2;"@CTVNews I urge you to investigate #CDCwhistleblower . Im a fellow Canadian who knows the ripple effects of u.s. news affectin Canadian fams";;@CTVNews;#CDCwhistleblower;"505140758736015360";https://twitter.com/Autismwithwine/status/505140758736015360
RobertLong2017;2014-08-29 01:51;1;1;"Some say if we don't preserve biodiversity there will be an intense ripple effect to the world's economy and banks. #ees028 #biodiversity";;;#ees028 #biodiversity;"505140751756324864";https://twitter.com/RobertLong2017/status/505140751756324864
rshepherd1964;2014-08-29 01:48;0;0;"Preserving 'Rasberry Ripple ' Tornado ZA326 at Bruntingthorpe http://www. urbanghostsmedia.com/?p=23065 via @UrbanGhosts";;@UrbanGhosts;;"505139859682365441";https://twitter.com/rshepherd1964/status/505139859682365441
AmazingEtsians;2014-08-29 01:44;0;0;"Ripple Surreal Original Acrylic Painting by annarobertsart http:// etsy.me/1tDFpRd via @Etsy #art #painting #original";;@Etsy;#art #painting #original;"505138790843678720";https://twitter.com/AmazingEtsians/status/505138790843678720
tishpix;2014-08-29 01:43;0;0;"Know That Your KINDNESS Has A Ripple Effect in the Universe. #REPOST @gravitycgroup http:// instagram.com/p/sQsX9knsAf/";;@gravitycgroup;#REPOST;"505138753749655552";https://twitter.com/tishpix/status/505138753749655552
Joey_Wilde;2014-08-29 01:38;0;3;"A ripple in the water can teach you a lot about life. It's like your actions. They ripple out in the world. So do good things people.";;;;"505137268710211584";https://twitter.com/Joey_Wilde/status/505137268710211584
Indy_Events;2014-08-29 01:36;0;0;"09/27 #Indy - 15th Annual Rocky Ripple Festival in Indianapolis. http:// indyevents.com/view_event.php ?reminder_id=619322&ref=TWTR … #Indianapolis #Indiana";;;#Indy #Indianapolis #Indiana;"505136762838974466";https://twitter.com/Indy_Events/status/505136762838974466
chriscobbsalad;2014-08-29 01:34;0;1;"Sippin' some ripple , I got quarters, dimes, and nickels";;;;"505136480671784960";https://twitter.com/chriscobbsalad/status/505136480671784960
tvr1313_ripple;2014-08-29 01:30;0;0;"Hurray! I have finished "Helping Neighbors" task in Big Business HD for iPad! http:// tinyurl.com/opvy7am #ipadgames #gameinsight #ipad";;;#ipadgames #gameinsight #ipad;"505135338776711168";https://twitter.com/tvr1313_ripple/status/505135338776711168
tvr1313_ripple;2014-08-29 01:30;0;0;"I got a reward: Dirt Bane http:// tinyurl.com/qdwzbqq #ipadgames #gameinsight #ipad";;;#ipadgames #gameinsight #ipad;"505135304093995008";https://twitter.com/tvr1313_ripple/status/505135304093995008
dickij10;2014-08-29 01:29;0;1;"#resolve11 Can you Ripple trim the first clip on the timeline (to move the whole track). Having trouble.";;;#resolve11;"505135006537089024";https://twitter.com/dickij10/status/505135006537089024
___wooda;2014-08-29 01:28;1;1;"I really wish my sis @ImNoSHAEdyBitch come back to the band and really show some of them girls how to throw a ripple & march";;@ImNoSHAEdyBitch;;"505134777406857217";https://twitter.com/___wooda/status/505134777406857217
qutgirl2;2014-08-29 01:27;0;0;"♫ Ripple In Time by George Duke #nowplaying via @groovemusicapp pic.twitter.com/jnvo3Ypmvn";;@groovemusicapp;#nowplaying;"505134490394447872";https://twitter.com/qutgirl2/status/505134490394447872
ripplethreads;2014-08-29 01:26;0;0;"Signs of warmfest are appearing! @Broad_ Ripple #partytime http:// instagram.com/p/sQqZYVuPrr/";;@Broad_;#partytime;"505134403975405569";https://twitter.com/ripplethreads/status/505134403975405569
lawrie_heather;2014-08-29 01:25;0;0;"@edsheeran where in LA?! If your near Santa Monica I'm the obviously Irish raspberry ripple ...";;@edsheeran;;"505134051725152256";https://twitter.com/lawrie_heather/status/505134051725152256
ABabyBlanket;2014-08-29 01:25;0;0;"A new video is up! crochet learners corner ..June group project Baby Ripple Blanket - http:// goo.gl/iM0MWP";;;;"505134006623412225";https://twitter.com/ABabyBlanket/status/505134006623412225
JayohMusic12;2014-08-29 01:24;0;0;"writting some music! beats from Ripple OnThe Beat Tye Knox Beats & Alex Santos yeeeeeeeesss!!!!";;;;"505133907923066881";https://twitter.com/JayohMusic12/status/505133907923066881
Alexa_Kelly47;2014-08-29 01:23;0;0;"Had a lovely dinner and coffee date in Broad Ripple with the boyf";;;;"505133714003607552";https://twitter.com/Alexa_Kelly47/status/505133714003607552
lawrie_heather;2014-08-29 01:23;0;1;"Was on the beach in LA for 3 hours and i already look like a raspberry ripple ! #summertimesadness";;;#summertimesadness;"505133682265714688";https://twitter.com/lawrie_heather/status/505133682265714688
endless_decay;2014-08-29 01:23;0;0;"Doing an experimental wash cycle on Buster's ugly ripple blanket. I'm testing the durability of my crochet techniques.";;;;"505133504917950465";https://twitter.com/endless_decay/status/505133504917950465
RadKitchenLDN;2014-08-29 01:22;0;0;"Photo: My Growing Communities veggie box this week. Ripple Farm organic mixed kale from Kent, Hackney... http:// tmblr.co/ZPxfsw1PSHskv";;;;"505133323023560704";https://twitter.com/RadKitchenLDN/status/505133323023560704
The_CBH;2014-08-29 01:18;0;0;"http:// ift.tt/1vrteJv Anni Piper will be holding two free shows at the Ram's Ripple in Moses Lake at 8 p.m. on Friday and Saturday.";;;;"505132361361932288";https://twitter.com/The_CBH/status/505132361361932288
healynC;2014-08-29 01:14;0;0;"A Harvard professor recently warned that #CCD is only the beginning for us. The ripple effect from new classes of... http:// fb.me/2ASxU2lJl";;;#CCD;"505131270490566656";https://twitter.com/healynC/status/505131270490566656
R_E_Palmer;2014-08-29 01:14;1;0;""A ripple moved towards her. Something below the lake implored her to enter; it wasn’t a fairy." SKY - only 99c http:// viewBook.at/Sky";;;;"505131246905606144";https://twitter.com/R_E_Palmer/status/505131246905606144
Natural_Blaze;2014-08-29 01:13;0;0;"A Harvard professor recently warned that #CCD is only the beginning for us. The ripple effect from new classes of... http:// fb.me/3a91VKg6L";;;#CCD;"505131170934562819";https://twitter.com/Natural_Blaze/status/505131170934562819
Zoldameitrihana;2014-08-29 01:11;0;1;"Orchard Desserts blueberry ripple :3 http:// instagram.com/p/sQopvvEMDu/";;;;"505130569026400256";https://twitter.com/Zoldameitrihana/status/505130569026400256
